,岗位名称,薪资待遇,岗位详情,岗位地区,公司福利,公司名称,岗位需要技能,salary1,salary2,学历要求,工作经验要求,福利数量,需求技能数量,公司类型,融资情况,公司人数,score
816,数据分析师,20-35K,1-3年，本科,北京,交通补助，五险一金，年终奖，带薪年假，加班补助，补充医疗保险，定期体检，餐补，节日福利，全勤奖，零食下午茶,学而思网校,Python，SQL，Excel，Tableau，Hive，Power BI，BI,12,27.5,本科,1-3年,11,7,在线教育,已上市,1000-9999人,0.8572392910957155
817,数据分析师,100-200元/天,3天/周，本科,济南,五险一金,济南阿卡尔大数据科技,数学/统计相关专业，经济/工商管理相关专业，有魄力，有胆量,12,4.5,本科,经验不限,1,4,计算机软件,未融资,0-20人,0.13590019045344404
818,数据分析师,5-8K,1-3年，本科,石家庄,,石家庄天远集团,Python，SQL，Excel，Tableau,12,6.5,本科,1-3年,0,4,智能硬件,不需要融资,500-999人,0.21011493084435343
819,数据分析师,25-35K,5-10年，本科,北京,五险一金，节日福利，带薪年假，年终奖，住房补贴，全勤奖，补充医疗保险，交通补助，定期体检，股票期权，零食下午茶,一亩田,数据分析，SQL，Excel,12,30.0,本科,5-10年,11,3,O2O,C轮,500-999人,0.6107043520548814
820,数据分析师,6-10K,1-3年，本科,嘉兴,宿舍有空调，底薪加提成，包吃，包吃，生日福利，包住，零食下午茶，巨额开门红，年终奖，工龄奖，有无线网，员工旅游，企业年金，法定节假日三薪，绩效奖金，五险，节日福利，团建聚餐，带薪年假，内购福利,喜歌实业,SQL，聚类分析，参数检验，效度分析，回归分析，相关分析,12,8.0,本科,1-3年,20,6,服装/纺织/皮革,未融资,1000-9999人,0.5082442728880306
821,数据分析师,25-50K·16薪,3-5年，本科,深圳,交通补贴，餐补，员工旅游，零食下午茶，加班补助，定期体检，节日福利，年终奖，五险一金,富途,Python，SQL，Excel，BI，大数据,16,37.5,本科,3-5年,9,5,互联网,已上市,1000-9999人,0.83675420846843
822,数据分析师,11-20K,3-5年，本科,成都,五险一金，员工旅游，定期体检，节日福利，带薪年假，股票期权,智库2861,Python，数据分析，数据挖掘，R，人工智能，Matlab,12,15.5,本科,3-5年,6,6,互联网,不需要融资,20-99人,0.25957060014670763
823,数据分析师,5-10K,1-3年，大专,南昌,带薪年假，定期体检，包吃，年终奖，底薪加提成，加班补助，全勤奖，节日福利，零食下午茶，生日福利，工龄奖，高温补贴，五险一金，股票期权，绩效奖金，员工旅游，团建聚餐，住房补贴,南昌哈彼,SPSS，SAS，Excel，Tableau，R,12,7.5,大专,1-3年,18,5,电子商务,未融资,100-499人,0.38902150256146184
824,数据分析师,3-4K,经验不限，大专,长春,节日福利，年终奖，员工旅游，股票期权，五险一金,融澳科技,Excel,12,3.5,大专,经验不限,5,1,移动互联网,未融资,0-20人,0.12412109276210294
825,数据分析师,3-5K,1-3年，大专,黄冈,五险一金，通讯补贴，餐补，节日福利，交通补助，员工旅游,湖北齐兴,逻辑分析及文字功底，Python，决策树，描述统计，相关分析,12,4.0,大专,1-3年,6,5,财务/审计/税务,不需要融资,20-99人,0.19976846545943341
826,数据分析师（兰州）,5-9K·13薪,1-3年，本科,兰州,定期体检，生日福利，餐补，通讯补贴，加班补助，节假日加班费，交通补助，年终奖，节日福利，带薪年假，五险一金,中海华晟,R，Excel，SAS，SPSS，SQL，Python,13,7.0,本科,1-3年,11,6,运营商/增值服务,不需要融资,100-499人,0.3296592193506028
827,数据分析师（滁州）,7-12K·14薪,1-3年，硕士,滁州,免费班车，五险一金，补充医疗保险，节日福利，员工旅游，餐补，定期体检，带薪年假，交通补助，年终奖，通讯补贴,城市智能科技,市政工程，安全工程，土木工程,14,9.5,硕士,1-3年,11,3,计算机软件,不需要融资,100-499人,0.26171794483980715
828,高级数据分析师,20-40K·13薪,5-10年，本科,杭州,年终奖，五险一金，节日福利，股票期权，餐补，员工旅游，交通补助，零食下午茶，免费班车，补充医疗保险,阿里巴巴集团,Python，SQL,13,30.0,本科,5-10年,10,2,互联网,已上市,10000人以上,0.7031272707175177
829,数据分析师,20-40K·14薪,经验不限，本科,北京,底薪加提成，通讯补贴，保底工资，年终奖，零食下午茶，五险一金，工龄奖，法定节假日三薪，绩效奖金，夜班补助，企业年金，节假日加班费，带薪年假，股票期权，节日福利，餐补，补充医疗保险，加班补助，定期体检，员工旅游,浩淘科技,数据挖掘，SQL，Python，SAS,14,30.0,本科,经验不限,20,4,移动互联网,未融资,0-20人,0.5791297173250457
830,数据分析师,3-5K,1-3年，本科,大连,节日福利，带薪年假，定期体检，年终奖，全勤奖，五险一金，员工旅游,大连品誉集团,Excel，参数检验，决策树,12,4.0,本科,1-3年,7,3,在线教育,不需要融资,500-999人,0.24444399758300048
831,数据分析师,10-15K·13薪,5-10年，本科,苏州,全勤奖，股票期权，五险一金，交通补助，通讯补贴，节日福利，员工旅游，住房补贴,凌旭科技,SQL，Python，数学/统计相关专业，计算机相关专业,13,12.5,本科,5-10年,8,4,计算机软件,A轮,100-499人,0.3226411123329893
832,数据分析师,9-14K,1-3年，本科,长沙,餐补，补充医疗保险，节日福利，五险一金，带薪年假，零食下午茶,安存科技,数据分析，数据挖掘，大数据，人工智能,12,11.5,本科,1-3年,6,4,计算机软件,天使轮,20-99人,0.2482628124291412
833,数据分析师,8-12K,3-5年，本科,苏州,免费班车，带薪年假，年终奖，互助基金，五险一金，定期体检，节日福利，结婚礼金，通讯补贴，包吃，工作餐,江苏新美星,回归分析，效度分析，描述统计，Excel，Hadoop,12,10.0,本科,3-5年,11,5,机械设备/机电/重工,已上市,500-999人,0.5654689080249762
834,数据分析师,20-40K·18薪,在校/应届，本科,上海,带薪年假，节日福利，包吃，定期体检，交通补助，股票期权，年终奖，五险一金,拼多多,SQL，Python，Hive,18,30.0,本科,在校/应届,8,3,移动互联网,已上市,1000-9999人,0.8567819709007665
835,数据分析师,8-12K,1年以内，本科,广州,定期体检，加班补助，节日福利，零食下午茶，员工旅游，交通补助，五险一金，年终奖，带薪年假,仟传,Python，SQL，Power BI，经济/工商管理相关专业,12,10.0,本科,1年以内,9,4,互联网,B轮,500-999人,0.48264117648365046
836,数据分析师,8-12K·13薪,1-3年，本科,成都,带薪年假，定期体检，五险一金，节日福利，年终奖，全勤奖，股票期权，零食下午茶，生日福利,之了,Power BI,13,10.0,本科,1-3年,9,1,在线教育,不需要融资,1000-9999人,0.3254304077588744
837,数据分析师,2-6K,经验不限，大专,眉山,,眉山锦岑科技,计算机相关专业，数据分析/挖掘经验,12,4.0,大专,经验不限,0,2,数据服务,未知,0-20人,0.09505425542177948
838,数据分析师,15-30K,3-5年，本科,北京,五险一金，带薪年假，节日福利,哗啦啦,Excel，SQL，Tableau，Python，聚类分析，相关分析,12,22.5,本科,3-5年,3,6,移动互联网,不需要融资,1000-9999人,0.49178590259610316
839,数据分析师,10-15K·13薪,3-5年，本科,长沙,五险一金，节日福利，年终奖，交通补助，工龄奖，带薪年假，生日福利，餐补,磐基讯析,SQL，Python，SAS，机器学习 智慧营销,13,12.5,本科,3-5年,8,4,计算机软件,未融资,20-99人,0.22524047245481632
840,Python数据分析师,150-230元/天,5天/周，,上海,五险一金,麦开信息,电商数据分析，Python，SQL,12,5.0,学历不限,经验不限,1,3,互联网,不需要融资,0-20人,0.31137702108508863
841,数据分析师,30-45K·15薪,3-5年，本科,上海,,卓锦兰,SQL，互联网、咨询行业经验,15,37.5,本科,3-5年,0,2,人力资源服务,未知,0-20人,0.27960968763809346
842,数据分析师,6-7K,经验不限，本科,杭州,加班补助，各类团建，定期体检，健身房，节日福利，绩效奖金，员工旅游，带薪年假，六险一金，年终奖，零食下午茶,火奴数据,电商数据分析,12,6.5,本科,经验不限,11,1,数据服务,不需要融资,100-499人,0.32154228552521746
843,数据分析师,8-13K,3-5年，学历不限,上海,,JATTO,数据分析，数据挖掘，Python，Excel，数据采集，BI,12,10.5,学历不限,3-5年,0,6,电子商务,未融资,20-99人,0.3504251091609858
844,数据分析师（核心收入方向）,25-50K·16薪,3-5年，本科,北京,交通补助，节日福利，住房补贴，股票期权，员工旅游，带薪年假，定期体检，餐补，年终奖，加班补助，补充医疗保险,BOSS直聘,数据分析,16,37.5,本科,3-5年,11,1,人力资源服务,已上市,1000-9999人,0.7931981794042327
845,高级数据分析师,20-40K,3-5年，本科,南京,生日福利，股票期权，法定节假日三薪，定期体检，节假日加班费，五险一金，带薪年假，加班补助，节日福利，团建聚餐，补充医疗保险，意外险,多链互联,Excel，Power BI,12,30.0,本科,3-5年,12,2,企业服务,A轮,20-99人,0.37578302667261126
846,资深数据分析师,30-40K·15薪,5-10年，本科,上海,带薪年假，节日福利，股票期权，混合办公，补充医疗保险，五险一金，年终奖，免费班车，员工旅游，定期体检,携程集团,Python，SQL，R,15,35.0,本科,5-10年,10,3,互联网,已上市,10000人以上,0.818028901846774
847,BI高级数据分析师,20-35K·14薪,3-5年，本科,杭州,交通补助，定期体检，节日福利，年终奖，股票期权，员工旅游，带薪年假，5天带薪病假，零食下午茶，五险一金,尖兵科技,数据分析，SQL，商业分析，用户增长体系，产品数据分析,14,27.5,本科,3-5年,10,5,互联网,B轮,100-499人,0.5448592004014844
848,阿里巴巴－技术风险领域数据分析师,20-40K·16薪,3-5年，硕士,杭州,节日福利，股票期权，年终奖，零食下午茶，交通补助，免费班车，补充医疗保险，五险一金，员工旅游，餐补,阿里巴巴集团,数据分析，数据挖掘，数据仓库，商业分析，ETL,16,30.0,硕士,3-5年,10,5,互联网,已上市,10000人以上,0.811358812166617
849,高级数据分析师（买家增长方向）-【电商】,25-45K·16薪,3-5年，本科,北京,补充医疗保险，五险一金，定期体检，年终奖，带薪年假，股票期权，节日福利,快手,SQL，Python，电商/零售行业数据相关经验，用户增长,16,35.0,本科,3-5年,7,4,社交网络,已上市,10000人以上,0.8580404835084687
850,大数据分析师,6-10K·13薪,1-3年，本科,大连,意外险，带薪年假，通讯补贴，绩效奖金，节日福利，年终奖，生日福利，交通补助，团建聚餐，定期体检，五险一金，员工旅游，餐补,辽宁卓信普惠征信服务,Python，R，SQL，数据分析/挖掘经验，机器学习建模经验,13,8.0,本科,1-3年,13,5,计算机软件,未融资,20-99人,0.2860674633027375
851,大数据分析工程师,16-22K·14薪,3-5年，本科,上海,五险一金，补充医疗保险，定期体检，股票期权，带薪年假，员工旅游,节卡机器人,Python，SQL，Spark，Storm，Hadoop，MapReduce,14,19.0,本科,3-5年,6,6,其他行业,D轮及以上,100-499人,0.6004020272595899
852,数据分析 跨境电商,4-8K,经验不限，大专,南京,节日福利，零食下午茶，底薪加提成，全勤奖，有无线网，补充医疗保险，餐补，员工旅游，五险一金，定期体检，带薪年假，生日福利，年终奖,隆麦信息技术,Excel,12,6.0,大专,经验不限,13,1,电子商务,未融资,20-99人,0.2865572782749591
853,数据分析,4-5K,经验不限，硕士,上海,五险一金，补充医疗保险，年终奖，加班补助，定期体检，通讯补贴，带薪年假，股票期权,NIO蔚来,Power BI，数据分析/挖掘经验，计算机相关专业，SQL,12,4.5,硕士,经验不限,8,4,汽车生产,已上市,10000人以上,0.7314409546210557
854,数据分析,3-5K,经验不限，大专,济南,法定节假日三薪，员工旅游，工龄奖，全勤奖，五险一金，加班补助，底薪加提成,山东芈品经贸有限公司,数据分析，商业分析,12,4.0,大专,经验不限,7,2,批发/零售,不需要融资,100-499人,0.2623328042548666
855,数据分析专员,5-10K·15薪,1-3年，大专,大连,保底工资，节日福利，团建聚餐，零食下午茶，意外险，生日福利，带薪年假，五险一金,大连洛斯信息技术,Power BI，R，Python,15,7.5,大专,1-3年,8,3,电子商务,未知,20-99人,0.23263970842044052
856,数据分析专员,12-18K·13薪,1-3年，本科,上海,员工旅游，五险一金，股票期权，加班补助，团建聚餐，零食下午茶，节假日加班费，有无线网，底薪加提成，定期体检，法定节假日三薪，补充医疗保险，意外险，生日福利，节日福利，带薪年假，全勤奖，年终奖，绩效奖金，交通补助,上海竹棠贸易有限公司,数据分析，SQL，SPSS，数据采集，数据开发，数据挖掘,13,15.0,本科,1-3年,20,6,互联网,不需要融资,100-499人,0.5511086097836173
857,数据分析师,4-7K,1-3年，大专,合肥,工龄奖，法定节假日三薪，餐补，带薪年假，定期体检，年终奖，五险一金，意外险，住房补贴，高温补贴，全勤奖，通讯补贴，节日福利，免费工装，生日福利，补充医疗保险，团建聚餐,京东物流,方差分析,12,5.5,大专,1-3年,17,1,物流/仓储,已上市,10000人以上,0.6428482745569347
858,数据分析师,20-40K·16薪,3-5年，本科,杭州,五险一金，交通补助，加班补助，通讯补贴，补充医疗保险，餐补，零食下午茶，定期体检,阿里集团,Python，大数据，数据分析,16,30.0,本科,3-5年,8,3,移动互联网,已上市,10000人以上,0.7661060968048282
859,数据分析,150-200元/天,5天/周，本科,上海,股票期权，零食下午茶，补充医疗保险，年终奖，带薪年假，五险一金，员工旅游，节日福利，住房补贴，定期体检,数策股份,SQL，Python，数学/统计相关专业，计算机相关专业,12,5.0,本科,经验不限,10,4,计算机软件,D轮及以上,100-499人,0.5951226252227078
860,数据分析,6-11K,3-5年，本科,长沙,年终奖，健身房，五险一金，节日福利，免费班车，零食下午茶，住房补贴，多样化食堂，餐补，股票期权,兴盛优选,R，Python,12,8.5,本科,3-5年,10,2,电子商务,D轮及以上,10000人以上,0.5367756742666282
861,反欺诈数据分析,5-10K,1年以内，本科,深圳,补充医疗保险，定期体检，五险一金，年终奖,晓花科技,SQL，Python，消费金融,12,7.5,本科,1年以内,4,3,互联网金融,未知,100-499人,0.28084419309447733
862,数据分析工程师,10-15K,1-3年，本科,北京,五险一金，全勤奖，带薪年假，节日福利,第一车网,Python,12,12.5,本科,1-3年,4,1,互联网,B轮,500-999人,0.419941035672949
863,高级数据分析 (MJ002389),12-20K,1-3年，本科,北京,加班补助，员工旅游，年终奖，带薪年假，五险一金，餐补，节日福利,神州租车,SQL，Python，数学/统计相关专业，计算机相关专业,12,16.0,本科,1-3年,7,4,生活服务,已上市,10000人以上,0.7388821105764948
864,数据分析实习生,180-220元/天,5天/周，硕士,北京,餐补，五险一金，节日福利，员工旅游，包吃，带薪年假，通讯补贴，年终奖，交通补助，加班补助，定期体检，股票期权，零食下午茶,SandStar视达,Tableau，Python，SQL，回归分析，聚类分析，决策树,12,5.5,硕士,经验不限,13,6,计算机软件,B轮,100-499人,0.5918779587950433
865,数据分析师,5-6K,经验不限，本科,扬州,住房补贴，补充医疗保险，年终奖，股票期权，带薪年假，五险一金，餐补，定期体检，节日福利,万得扬州,描述统计,12,5.5,本科,经验不限,9,1,互联网金融,不需要融资,1000-9999人,0.3385991074669149
866,高级数据分析,8-13K,1-3年，本科,武汉,宿舍有空调，夜班补助，保底工资，企业年金，股票期权，五险一金，带薪年假，员工旅游，俱乐部，节假日加班费，意外险，年终奖，底薪加提成，零食下午茶，绩效奖金，专业培训，节日福利，全勤奖，生日福利，团建聚餐,易佰网络,SQL，Python，R，Pandas，Excel，SPSS,12,10.5,本科,1-3年,20,6,电子商务,已上市,1000-9999人,0.7594582131228073
867,数据分析统计员,4-6K,1年以内，大专,广州,,广州市微咨精博公司,数据分析/挖掘经验，Excel函数、公式，办公软件，项目管理,12,5.0,大专,1年以内,0,4,其他服务业,未融资,20-99人,0.18660085137796856
868,数据分析工程师,3-6K,经验不限，大专,青岛,五险一金，加班补助，年终奖,青岛慧合众诚,SQL，Python，Excel,12,4.5,大专,经验不限,3,3,仪器仪表/工业自动化,未知,0-20人,0.15498210073183571
869,数据分析实习生,110-150元/天,7天/周，本科,西宁,定期体检，餐补，五险一金，团建聚餐，通讯补贴，带薪年假，补充医疗保险，绩效奖金，定期体检，年终奖，股票期权，交通补助，免费班车，生日福利，节日福利，加班补助,亚信科技,SPSS，数学/统计相关专业，计算机相关专业,12,3.5,本科,经验不限,16,3,计算机软件,已上市,10000人以上,0.7064602429977703
870,数据分析实习生,200-300元/天,4天/周，本科,上海,年终奖，节日福利，定期体检，带薪年假，补充医疗保险，股票期权，五险一金，零食下午茶，餐补，通讯补贴，全勤奖，包吃，员工旅游，交通补助,bilibili,SQL，数学/统计相关专业，数据分析/挖掘经验,12,7.5,本科,经验不限,14,3,互联网,已上市,10000人以上,0.8029897168957296
871,Python数据分析学科负责人,30-45K,3-5年，大专,北京,底薪加提成，员工旅游，加班补助，通讯补贴，带薪年假，法定节假日三薪，交通补助，保底工资，绩效奖金，年终奖，节日福利，五险一金,路飞学城,Python，数据分析/挖掘经验,12,37.5,大专,3-5年,12,2,在线教育,A轮,20-99人,0.5124353342829275
872,数据分析工程师（东昌府）,7-9K,1-3年，本科,聊城,节日福利，餐补，五险一金，年终奖，加班补助，带薪年假，员工旅游,东之林,SQL，计算机相关专业,12,8.0,本科,1-3年,7,2,计算机软件,未融资,20-99人,0.14116735451802
873,数据分析师-BI工程师,6-11K·13薪,1-3年，本科,深圳,五险一金，交通补助,广州博锐,SQL，Python，Java，FineReport（帆软），Hyperion，excel,13,8.5,本科,1-3年,2,6,企业服务,未融资,20-99人,0.2755479638456742
874,数据分析(供应链计划管理方向),7-10K,1-3年，本科,杭州,零食下午茶，五险一金，节日福利，带薪年假,逸丞科技,Python，R，数学/统计相关专业，数据分析/挖掘经验,12,8.5,本科,1-3年,4,4,电子商务,未融资,500-999人,0.3078392354820268
875,数据分析师-数字营销(非金融）,10-15K·13薪,1-3年，本科,上海,加班补助，定期体检，零食下午茶，节日福利，年终奖，员工旅游，带薪年假，五险一金,上海奇昭,计算机专业，管理咨询工作经验，数学/统计学专业，SQL,13,12.5,本科,1-3年,8,4,电子商务,不需要融资,0-20人,0.27898436673057875
876,数据分析专员,4-6K,1-3年，本科,佛山,,欧昊集团,业务数据分析，业务模式/运营策略优化，互联网金融,12,5.0,本科,1-3年,0,3,建材,A轮,1000-9999人,0.2984039562206278
877,数据分析专员,5-10K,经验不限，学历不限,芜湖,,北凌科技,竞品分析，数据分析/商业分析经验,12,7.5,学历不限,经验不限,0,2,通信/网络设备,未知,20-99人,0.24409815149869513
878,数据分析,8-13K,1-3年，本科,绍兴,餐补，通讯补贴，定期体检，包吃，带薪年假，节日福利，免费班车，五险一金，交通补助,精工电源,多元统计分析,12,10.5,本科,1-3年,9,1,通信/网络设备,不需要融资,100-499人,0.1981068399655659
879,数据分析工程师,20-40K·15薪,1-3年，本科,深圳,免费健身房，免费班车，股票期权，公仔周边活动，五险一金，带薪年假，员工旅游，补充医疗保险，餐补，住房补贴，定期体检，绩效奖金，意外险，有无线网，包吃，年终奖，零食下午茶，免费早晚餐，交通补助，节日福利,腾讯,数据仓库，数据分析，SQL，Python，Shell，网络爬虫技术,15,30.0,本科,1-3年,20,6,互联网,不需要融资,10000人以上,0.775317786338327
880,数据分析专员,7-9K,1-3年，本科,南京,定期体检，子女福利，员工旅游，五险一金，通讯补贴，交通补助，零食下午茶，餐补，节日福利，带薪年假,先声药业,市场数据分析，营销,12,8.0,本科,1-3年,10,2,医疗健康,不需要融资,1000-9999人,0.3412020205484437
881,数据分析实习生,150-200元/天,4天/周，本科,北京,五险一金，节日福利，包吃，全勤奖，带薪年假，免费班车，补充医疗保险，年终奖，定期体检,网易,运营专员，数据分析,12,5.0,本科,经验不限,9,2,移动互联网,已上市,10000人以上,0.7289632833690148
882,高级数据分析与挖掘工程师,20-30K·14薪,5-10年，硕士,深圳,免费班车，交通补助，节日福利，五险一金，餐补，股票期权，通讯补贴，加班补助，员工旅游，零食下午茶，包吃，带薪年假，年终奖，定期体检,顺丰科技,Python，Scala，深度学习算法，推荐算法，机器学习算法,14,25.0,硕士,5-10年,14,5,互联网,不需要融资,1000-9999人,0.5403387993808967
883,数据分析实习岗（商科专业背景）,100-150元/天,4天/周，本科,深圳,五险一金，年终奖，股票期权，带薪年假,前海梧桐（深圳）...,SQL，Python，经济，金融，财务管理,12,3.5,本科,经验不限,4,5,互联网金融,A轮,20-99人,0.3783877409073222
884,商业数据分析,15-20K,3-5年，本科,广州,补充医疗保险，定期体检，五险一金，交通补助，带薪年假，餐补，年终奖，通讯补贴，员工旅游，节日福利，13薪，免费班车，股票期权,口碑,数据分析,12,17.5,本科,3-5年,13,1,O2O,不需要融资,10000人以上,0.43094581020928163
885,商业数据分析师,15-25K,1-3年，本科,上海,年终奖，交通补助，免费班车，补充医疗保险，员工旅游，包吃，零食下午茶，定期体检，通讯补贴，五险一金，带薪年假，股票期权，公司团建，餐补，节日福利,饿了么,数据分析，商业分析，SQL，Python，Excel,12,20.0,本科,1-3年,15,5,O2O,不需要融资,10000人以上,0.6352026013586617
886,初级数据分析员助理,8-10K,1-3年，大专,北京,带薪年假，补充医疗保险，定期体检，节日福利，全勤奖，零食下午茶，员工旅游，餐补，通讯补贴，交通补助，年终奖，五险一金,优科云图,数据分析,12,9.0,大专,1-3年,12,1,计算机软件,未融资,20-99人,0.2987568835510056
887,数据分析员,4-5K,1-3年，本科,廊坊,员工旅游，节日福利,香河博阳达信机械,数据分析/挖掘经验,12,4.5,本科,1-3年,2,1,原材料及加工/模具,不需要融资,20-99人,0.051387393753551384
888,电商数据分析专员,10-15K,3-5年，本科,杭州,交通补助，住房补贴，节日福利，加班补助，带薪年假，零食下午茶，年终奖，五险一金，餐补，股票期权，员工旅游,拾花社,Python，Power BI，SQL，电商/零售行业数据相关经验,12,12.5,本科,3-5年,11,4,电子商务,未融资,100-499人,0.325217131483442
889,数据分析员,7-10K,1-3年，本科,杭州,交通补助，五险一金，节日福利，通讯补贴，带薪年假，餐补，加班补助,万物互联,Excel,12,8.5,本科,1-3年,7,1,生活服务,A轮,20-99人,0.24447691180690453
890,BI数据分析师,7-12K,1-3年，本科,海口,全勤奖，加班补助，年终奖，带薪年假，五险一金，股票期权,商王道,机器学习建模经验，因子分析，数据分析/挖掘经验，参数检验,12,9.5,本科,1-3年,6,4,互联网,未融资,20-99人,0.1858435281481998
891,阿里银行/云图数据分析师,13-26K,1-3年，本科,上海,定期体检，绩效奖金，底薪加提成，五险一金，保底工资，生日福利，意外险，团建聚餐，带薪年假，节日福利,舜风传媒,Python，阿里数据银行，云图策略，京东数坊,12,19.5,本科,1-3年,10,4,广告/公关/会展,不需要融资,500-999人,0.46502113640922577
892,商业数据分析专家（直播行业）,45-55K·14薪,5-10年，本科,上海,节日福利，五险一金，带薪年假，年终奖，员工旅游，定期体检，补充医疗保险,美ONE,SQL,14,50.0,本科,5-10年,7,1,移动互联网,不需要融资,500-999人,0.49557582497133557
893,gis数据分析师,12-14K,3-5年，大专,深圳,节日福利，五险一金，定期体检，加班补助，带薪年假，补充医疗保险,亿达信息,GIS,12,13.0,大专,3-5年,6,1,计算机软件,不需要融资,1000-9999人,0.35027381229368465
