,岗位名称,薪资待遇,岗位详情,岗位地区,公司福利,公司名称,岗位需要技能,salary1,salary2,学历要求,工作经验要求,福利数量,需求技能数量,公司类型,融资情况,公司人数,score
1210,初级架构师,20-40K·14薪,3-5年，本科,深圳,节日福利，定期体检，餐补，员工旅游，交通补贴，五险一金，加班补助，年终奖，零食下午茶,富途,kubernetes，C/C++，golang,14,30.0,本科,3-5年,9,3,互联网,已上市,1000-9999人,0.7292554649578246
1211,资深前端架构师,15-20K·13薪,5-10年，本科,南昌,节假日加班费，生日福利，意外险，加班补助，员工旅游，夜班补助，节日福利，绩效奖金，补充医疗保险，年终奖，交通补助，高温补贴，餐补，通讯补贴，定期体检，五险一金,神舟信息安全评估中心,React，Vue，Angular，架构师经验，前端开发经验,13,17.5,本科,5-10年,16,5,信息安全,未融资,100-499人,0.36324492796497576
1212,Android系统架构师,55-75K,10年以上，本科,深圳,零食下午茶，定期体检，免费班车，带薪年假，员工旅游，年终奖，五险一金,TCL实业,架构设计能力，架构经验，性能,12,65.0,本科,10年以上,7,3,智能硬件,不需要融资,10000人以上,0.6464943514109074
1213,互联网Java高级工程师/架构师,20-40K·16薪,3-5年，本科,深圳,带薪年假，零食下午茶，定期体检，五险一金，股票期权，年终奖,OPPO,SQL，分布式技术，多线程，微服务架构，数据结构,16,30.0,本科,3-5年,6,5,互联网,不需要融资,10000人以上,0.6025734284506701
1214,前端架构师,20-40K·16薪,5-10年，本科,北京,定期体检，节日福利，带薪年假，补充医疗保险，股票期权，五险一金，年终奖,快手,Web端，PC端,16,30.0,本科,5-10年,7,2,社交网络,已上市,10000人以上,0.7630807269454242
1215,天猫技术部-Java架构师,30-50K,3-5年，本科,杭州,定期体检，餐补，员工旅游，补充医疗保险，年终奖，免费班车，五险一金，带薪年假,天猫,Java，后端开发，系统架构,12,40.0,本科,3-5年,8,3,互联网,已上市,10000人以上,0.7685379003340521
1216,图像识别算法架构师,35-50K·13薪,3-5年，硕士,上海,节日福利，五险一金，带薪年假，零食下午茶，员工旅游，定期体检,乐柠科技,视觉图像算法，深度学习算法，机器学习算法，C++，Python,13,42.5,硕士,3-5年,6,5,互联网,未融资,20-99人,0.4361847233095622
1217,用户增长 研发工程师/架构师,30-60K·16薪,3-5年，本科,北京,定期体检，补充医疗保险，五险一金，年终奖，股票期权，节日福利，带薪年假,快手,短视频，移动互联网，互联网，电子商务,16,45.0,本科,3-5年,7,4,社交网络,已上市,10000人以上,0.9081964312987129
1218,应用解决方案架构师,20-30K·15薪,3-5年，本科,武汉,五险一金，零食下午茶，工作餐，团建活动,追月,售前技术支持经验，农业信息化项目，计算机/通信相关专业,15,25.0,本科,3-5年,4,3,数据服务,未融资,100-499人,0.30738919391980024
1219,系统架构师/SE（三方兼容专家）,60-90K·15薪,5-10年，本科,上海,五险一金，年终奖，交通补助，全勤奖，餐补，住房补贴，带薪年假，节假日加班费，法定节假日三薪,鲲胜,架构设计/优化，研发流程优化，计算机/软件工程相关专业,15,75.0,本科,5-10年,9,3,人力资源服务,不需要融资,0-20人,0.5554302177742236
1220,嵌入式系统架构师,20-40K,5-10年，本科,北京,,慧眼电子,C++，ARM开发，嵌入式,12,30.0,本科,5-10年,0,3,汽车零部件,未知,20-99人,0.2638094784575911
1221,高级软件工程师/架构师,25-50K,3-5年，本科,北京,,Hanalytics,Python，机器学习，云计算,12,37.5,本科,3-5年,0,3,互联网,B轮,100-499人,0.4803919802790998
1222,低代码平台架构师（UC）,25-50K,5-10年，本科,北京,五险一金，员工旅游，股票期权，年终奖，节日福利，带薪年假，通讯补贴，补充医疗保险，定期体检,销售易CRM,分布式技术，多线程，微服务架构，Spring，SpringCloud,12,37.5,本科,5-10年,9,5,移动互联网,D轮及以上,1000-9999人,0.7581720663840911
1223,操作系统测试架构师(J10973),25-50K·15薪,5-10年，本科,成都,定期体检，补充医疗保险，五险一金，年终奖，带薪年假，餐补，员工旅游,斑马网络,测试架构师,15,37.5,本科,5-10年,7,1,互联网,A轮,1000-9999人,0.4913971989353951
1224,资深算法/驱动/并行计算/系统架构师,45-75K,经验不限，本科,北京,加班补助，餐补，带薪年假，股票期权，定期体检，补充医疗保险，年终奖，五险一金,中星天视,驱动开发，Python，Verilog，FPGA开发，slam，gpu,12,60.0,本科,经验不限,8,6,电子/半导体/集成电路,未知,500-999人,0.7768103748397158
1225,曙光云售前解决方案架构师,25-50K,3-5年，本科,北京,节日福利，通讯补贴，加班补助，员工旅游，补充医疗保险，项目奖金，定期体检，交通补助，五险一金，包吃，带薪年假，全勤奖，免费班车,中科曙光,分布式技术，虚拟机技术，容器技术,12,37.5,本科,3-5年,13,3,互联网,已上市,1000-9999人,0.8111799551882957
1226,大数据架构师,18-35K,3-5年，本科,厦门,定期体检，节日福利，年终奖，员工关怀，补充医疗保险，带薪年假，工会福利，五险一金，零食下午茶，餐补,建信金科,数据架构师，数据仓库，Hive，Hadoop，Spark，Kafka,12,26.5,本科,3-5年,10,6,银行,不需要融资,1000-9999人,0.4875252377337149
1227,大数据架构师,20-40K,1-3年，本科,上海,零食下午茶，五险一金，股票期权，志愿者活动，带薪年假，年终奖，定期体检，项目奖金，节日福利,技容,数据仓库，数据库，数据架构,12,30.0,本科,1-3年,9,3,咨询,不需要融资,0-20人,0.3416594887833802
1228,大数据架构师,20-35K,5-10年，硕士,长沙,高温补贴，年终奖，员工旅游，股票期权，午餐，带薪年假，宿舍有空调，绩效奖金，通讯补贴，意外险，节日福利，交通补助，团建聚餐，五险一金,凯德股份,Python，Scala，分布式技术，Go，Java，Vue，大数据架构,12,27.5,硕士,5-10年,14,7,计算机软件,已上市,100-499人,0.6347990690258647
1229,银行数据架构,30-35K,5-10年，本科,北京,补充医疗保险，节日福利，定期体检，带薪年假，五险一金，加班补助,龙盈智达,大数据平台架构经验,12,32.5,本科,5-10年,6,1,互联网金融,不需要融资,1000-9999人,0.4325598161738127
1230,大数据架构师,30-45K·14薪,5-10年，本科,杭州,,吉利集团,Hadoop，Spark，Flink，大数据,14,37.5,本科,5-10年,0,4,互联网,未知,10000人以上,0.4855052814499233
1231,基础架构工程师,30-50K,3-5年，本科,北京,五险一金，节日福利，定期体检，年终奖，股票期权，住房补贴，带薪年假，补充医疗保险，交通补助，季度团建，零食下午茶,伴鱼,分布式技术，容器技术，数据结构，Java，Go，微服务架构,12,40.0,本科,3-5年,11,6,移动互联网,C轮,1000-9999人,0.8014760820427741
1232,架构建模分析师,25-45K·15薪,5-10年，本科,上海,带薪年假，意外险，生日福利，交通补助，节假日加班费，定期体检，股票期权，员工旅游，补充医疗保险，五险一金,上海齐方格科技,Java,15,35.0,本科,5-10年,10,1,汽车零部件,A轮,20-99人,0.4379401814822207
1233,系统架构设计师,20-30K,3-5年，本科,上海,,百业并购,系统架构，高级技术管理,12,25.0,本科,3-5年,0,2,互联网,未知,20-99人,0.22884578896554342
1234,网络体系架构研究员,30-40K,经验不限，博士,南京,包吃，住房补贴，员工旅游，带薪年假，年终奖，节日福利，五险一金，餐补，定期体检,紫金山实验室,"SDN, 路由，体系架构，云计算网络",12,35.0,博士,经验不限,9,3,政府/公共事业,不需要融资,1000-9999人,0.520469637121915
1235,平台软件架构总监,40-50K·16薪,10年以上，本科,深圳,股票期权，年终奖，带薪年假，五险一金,微合科技,嵌入式技术，网络协议，平台软件，RTOS，Linux，英文熟练,16,45.0,本科,10年以上,4,6,电子/半导体/集成电路,未知,20-99人,0.44251027459197095
1236,车载系统软件架构工程师,25-50K·13薪,5-10年，硕士,武汉,带薪年假，交通补助，五险一金，补充医疗保险，定期体检，年终奖,芯擎科技,虚拟机技术，分布式技术,13,37.5,硕士,5-10年,6,2,电子/半导体/集成电路,A轮,100-499人,0.37016935034378584
1237,自动驾驶-软件架构专家（北上广深）,60-90K·16薪,5-10年，本科,北京,生日福利，意外险，五险一金，交通补助，零食下午茶，餐补，定期体检，节日福利，补充医疗保险，团建聚餐，保底工资，年终奖，绩效奖金，股票期权，员工旅游，加班补助，法定节假日三薪，带薪年假,仕仁,嵌入式技术，汽车/自动驾驶/ADAS，C/C++,16,75.0,本科,5-10年,18,3,人力资源服务,未融资,20-99人,0.714411273343747
1238,大数据架构师,20-40K,3-5年，本科,北京,,吉荣数科技,Hadoop,12,30.0,本科,3-5年,0,1,互联网金融,不需要融资,20-99人,0.2416518400506889
1239,高级数据库工程师-数据库架构和性能优化,30-50K·14薪,5-10年，本科,北京,节日福利，五险一金，加班补助，定期体检，年终奖，带薪年假，零食下午茶，免费班车,网龙,MySQL，DBA工作经验，MySQL数据库管理经验,14,40.0,本科,5-10年,8,3,移动互联网,已上市,1000-9999人,0.7745034183666796
1240,数据安全顾问,20-30K·15薪,3-5年，本科,深圳,加班补助，股票期权，五险一金，全勤奖，零食下午茶，补充医疗保险，员工旅游，带薪年假，节日福利，年终奖,建安润星,数据分类分级，数据安全治理，数据安全风险评估,15,25.0,本科,3-5年,10,3,咨询,未融资,100-499人,0.41574469418516197
1241,数据治理工程师,20-30K·15薪,1-3年，本科,杭州,五险一金，年终奖，带薪年假，员工旅游，通讯补贴，节日福利，餐补,海亮集团,大数据平台架构经验，大数据处理经验，数学/统计相关专业,15,25.0,本科,1-3年,7,3,其他行业,已上市,10000人以上,0.7431160542211258
1242,数据咨询合伙人,25-50K,经验不限，学历不限,贵阳,,智启未来科技有限公司,SQL，Python，Java,12,37.5,学历不限,经验不限,0,3,企业服务,未知,0-20人,0.37131596939421296
1243,数据库开发工程师,8-13K,1-3年，大专,重庆,,亚鑫达,Linux，加密，Oracle,12,10.5,大专,1-3年,0,3,医疗健康,天使轮,20-99人,0.1728463574390957
1244,大数据运维工程师,8-12K,1-3年，本科,西安,年终奖，节日福利，五险一金，带薪年假，补充医疗保险,中能瑞通,Spark，Hadoop，Flume，HDFS，HIVE，Flink，Hbase,12,10.0,本科,1-3年,5,7,电力/热力/燃气/水利,未知,100-499人,0.2977023700461811
1245,数据治理工程师,15-30K,5-10年，本科,深圳,住房补贴，周末双休，五险一金，通讯补贴,比亚迪汽车工业,数据治理，主数据管理,12,22.5,本科,5-10年,4,2,汽车生产,已上市,10000人以上,0.6194131250772583
1246,高级数据治理工程师,16-25K,5-10年，本科,广州,加班补助，零食下午茶，餐补，定期体检，免费住宿，五险一金，免费班车，带薪年假，节日福利,蓝月亮,HIVE，Hbase，Flink，大数据，网络安全,12,20.5,本科,5-10年,9,5,生活服务,已上市,10000人以上,0.6895561736499184
1247,课程研发：云计算、大数据、AI方向-兼职,20-40K,5-10年，本科,上海,带薪年假，加班补助，五险一金，节假日加班费，绩效奖金，节日福利，法定节假日三薪，年终奖，股票期权,实战云,Java，微服务架构，网络爬虫技术，大数据架构，云计算架构,12,30.0,本科,5-10年,9,5,在线教育,天使轮,20-99人,0.42347230751655773
1248,资深数据工程师 MTS1 Data Engineer,30-50K,5-10年，本科,上海,五险一金，年终奖，股票期权，带薪年假，餐补，节日福利，零食下午茶,PayPal,数据仓库，数据开发，数据架构师，Java，Scala，Hive,12,40.0,本科,5-10年,7,6,互联网,已上市,10000人以上,0.8468140190907432
1249,大数据技术经理,12-20K,5-10年，本科,南昌,五险一金，带薪年假，节日福利，年终奖，零食下午茶,江西高创,Java，Shell，Spark，计算机相关专业,12,16.0,本科,5-10年,5,4,通信/网络设备,B轮,100-499人,0.3198858167575837
1250,数据工程师,15-25K·13薪,1-3年，本科,上海,节日福利，年终奖，五险一金，定期体检，员工旅游，带薪年假,英檬科技,Python，Java，OLAP，Pandas，Hadoop,13,20.0,本科,1-3年,6,5,数据服务,天使轮,20-99人,0.4034422257910826
1251,数据工程师(爬虫),15-28K·14薪,在校/应届，本科,北京,年终奖，交通补助，股票期权，有竞争力薪酬，定期体检，节日福利，支持远程工作，设备补贴，五险一金，带薪年假,尘宇空间,网络爬虫技术，网络协议，数据挖掘，Python，SQL,14,21.5,本科,在校/应届,10,5,互联网,不需要融资,0-20人,0.4372138973031802
1252,高级数据工程师,7-12K·13薪,3-5年，本科,上海,五险一金，节日福利，加班补助，全勤奖，交通补助，带薪年假，年终奖，餐补，员工旅游，零食下午茶，定期体检,海隆华思,SQL，Python，Spark,13,9.5,本科,3-5年,11,3,计算机服务,未融资,100-499人,0.34204325777783584
1253,中级数据工程师,15-22K,3-5年，本科,广州,五险一金，年终奖，节日福利，定期体检，员工旅游，带薪年假,贝斯平数据,Hive，电商/零售行业数据相关经验，Hadoop，阿里大数据,12,18.5,本科,3-5年,6,4,计算机软件,未融资,20-99人,0.24519266047349594
1254,人工智能数据工程师,200-250元/天,5天/周，本科,上海,节日福利，五险一金，带薪年假，新员工宿舍，绩效奖，定期体检，全勤奖，年终奖，内部晋升，职称工资，通讯补贴，餐补，员工旅游，加班补助,上海波创电气有限...,C/C++，Python，机器学习算法/工程化经验，深度学习经验,12,6.5,本科,经验不限,14,4,智能硬件,未融资,20-99人,0.41532875116674023
1255,集成平台数据工程师,5-10K,3-5年，大专,邯郸,法定节假日三薪，包住，团建聚餐，节日福利，加班补助，工龄奖，保底工资，节假日加班费，绩效奖金，宿舍有空调，交通补助，餐补，五险一金，带薪年假，生日福利，有无线网，股票期权,民腾计算机技术,ETL设计/开发经验，大数据开发经验,12,7.5,大专,3-5年,17,2,移动互联网,未融资,100-499人,0.28091779364163316
1256,高精度地图数据工程师,4-6K,经验不限，本科,廊坊,股票期权，零食下午茶，餐补，五险一金，员工旅游，带薪年假，节日福利，补充医疗保险，定期体检,微景数科,全职工作,12,5.0,本科,经验不限,9,1,互联网,未融资,100-499人,0.24210728507246185
1257,数据分析专员,12-18K·13薪,1-3年，本科,上海,员工旅游，五险一金，股票期权，加班补助，团建聚餐，零食下午茶，节假日加班费，有无线网，底薪加提成，定期体检，法定节假日三薪，补充医疗保险，意外险，生日福利，节日福利，带薪年假，全勤奖，年终奖，绩效奖金，交通补助,上海竹棠贸易有限公司,数据分析，SQL，SPSS，数据采集，数据开发，数据挖掘,13,15.0,本科,1-3年,20,6,互联网,不需要融资,100-499人,0.5511086097836173
1258,高级数据开发工程师,25-50K·16薪,3-5年，本科,上海,节日福利，零食下午茶，带薪年假，补充医疗保险，年终奖，通讯补贴，员工旅游，包吃，餐补，免费班车，住房补贴，交通补助，股票期权，五险一金，定期体检,支付宝,数据开发，Java，数据架构师,16,37.5,本科,3-5年,15,3,移动互联网,B轮,10000人以上,0.8081971961719818
1259,系统构架师,18-30K,5-10年，大专,福州,全勤奖，员工旅游，年终奖，带薪年假，餐补，节日福利，五险一金,龙誉行营,数据结构，系统架构，系统分析,12,24.0,大专,5-10年,7,3,广告/公关/会展,不需要融资,20-99人,0.2244771042588884
1260,资深信息安全工程师（安全架构）,30-60K,5-10年，本科,北京,加班补助，通讯补贴，节日福利，餐补，企业年金，五险一金，包吃，带薪年假，年终奖，生日福利，团建聚餐，法定节假日三薪，补充医疗保险，夜班补助，定期体检，交通补助，绩效奖金，节假日加班费,中体骏彩信息技术,安全体系架构和研发，安全架构搭建经验，CISSP/CISP,12,45.0,本科,5-10年,18,3,互联网,不需要融资,100-499人,0.5639434299730147
1261,软件架构工程师,16-22K,5-10年，本科,南京,补充医疗保险，通讯补贴，加班补助，五险一金，节日福利，年终奖，定期体检，交通补助，餐补，带薪年假,创博,.NET，C/C++，Java,12,19.0,本科,5-10年,10,3,通信/网络设备,不需要融资,20-99人,0.22848684134233777
1262,仿真系统架构工程师,20-30K,3-5年，本科,北京,五险一金，定期体检，节日福利，年终奖，带薪年假,中国科学院软件研究所,Python,12,25.0,本科,3-5年,5,1,计算机软件,不需要融资,1000-9999人,0.40896182270780435
1263,安卓系统架构工程师,20-35K,5-10年，大专,深圳,员工旅游，带薪年假，有无线网，节假日加班费，加班补助，生日福利，年终奖，节日福利，零食下午茶，交通补助，团建聚餐，绩效奖金，底薪加提成，五险一金,海格森,架构设计/优化，Android客户端产品研发，研发流程优化，Java,12,27.5,大专,5-10年,14,4,电子/半导体/集成电路,未知,20-99人,0.4037398355127699
1264,架构设计工程师,30-60K·16薪,10年以上，本科,深圳,年终奖，节日福利，员工旅游，带薪年假，通讯补贴，股票期权，补充医疗保险，五险一金，定期体检，零食下午茶,摩星半导体,半导体技术，电路设计，SOC，大规模芯片,16,45.0,本科,10年以上,10,4,电子/半导体/集成电路,不需要融资,未知,0.36010090405553075
1265,小米汽车-Audio音频系统架构,30-55K·15薪,10年以上，本科,上海,带薪年假，12%公积金，五险一金，股票期权，补充医疗保险，餐补，定期体检，节日福利，年终奖,小米,C++，C，RTOS，Audio音频，Audio hal,15,42.5,本科,10年以上,9,5,互联网,已上市,10000人以上,0.867960396342524
1266,微信支付架构治理开发工程师,20-40K·14薪,经验不限，本科,深圳,,财付通,Python，全栈开发，运营开发，测试开发，后台开发,14,30.0,本科,经验不限,0,5,社交网络,未知,10000人以上,0.6151010163191879
1267,前端架构工程师（南京）,20-25K·13薪,5-10年，本科,嘉兴,交通补助，年终奖，定期体检，员工旅游，带薪年假，加班补助，餐补，节日福利，通讯补贴，五险一金,河海中控,JavaScript，HTML5，Webpack，计算机/软件工程相关专业,13,22.5,本科,5-10年,10,4,其他行业,未融资,100-499人,0.3052782423903128
1268,数据仓库工程师,17-28K·14薪,3-5年，本科,上海,节日福利，年会旅游，五险一金，生日祝福，员工旅游，部门团建经费，工作餐,上海米居,数据仓库，ETL，架构师，DBA，数据库开发，数据开发,14,22.5,本科,3-5年,7,6,移动互联网,C轮,1000-9999人,0.6874548940662857
1269,数据库内核工程师 - 杭州研究院,45-65K,5-10年，本科,杭州,五险一金，加班补助，免费班车，节日福利，年终奖，定期体检，住房补贴，餐补，带薪年假，补充医疗保险，零食下午茶,网易杭州,网络编程，数据结构，多线程，架构师，Linux，MySQL,12,55.0,本科,5-10年,11,6,互联网,已上市,10000人以上,0.9184686299565329
1270,数据,4-5K,经验不限，学历不限,厦门,,泉州鑫棱贸易有限公司,无经验，实习盖章,12,4.5,学历不限,经验不限,0,2,电子商务,未知,0-20人,0.19352941887643074
1271,数据开发,25-50K,3-5年，本科,上海,五险一金，定期体检，带薪年假，餐补，免费班车,360集团,Java，Scala，Hadoop，Kafka，Storm，Flink，Pig，Presto,12,37.5,本科,3-5年,5,8,互联网,D轮及以上,1000-9999人,0.8009533528466484
1272,数据总监 (MJ000125),50-80K·15薪,5-10年，本科,北京,节日福利，年终奖，餐补，高额奖金，加班补助，股票期权，境外旅游，五险一金，交通补助，带薪年假，零食下午茶，员工旅游,莱熙科技,数据分析，数据洞察，业务理解，sql，hive，算法，策略,15,65.0,本科,5-10年,12,7,移动互联网,不需要融资,100-499人,0.73302922630108
1273,数据专员,3-5K,1-3年，中专/中技,清远,,清远市优代汽车服务,用户运营，车辆运营，数据运营,12,4.0,中专/中技,1-3年,0,3,交通/运输,未知,100-499人,0.18380876786565076
1274,数据建模,15-25K,5-10年，本科,南京,餐补，定期体检，年终奖，交通补助，五险一金，免费班车，通讯补贴，节日福利，包吃，带薪年假,苏宁金融,数据仓库，Hive,12,20.0,本科,5-10年,10,2,互联网,已上市,1000-9999人,0.5684236628103071
1275,数据开发,28-35K·15薪,3-5年，本科,北京,,美团,Python，Scala，Spark，Hadoop，Flink，Hbase，HIVE,15,31.5,本科,3-5年,0,7,互联网,已上市,10000人以上,0.8286826982458988
1276,数据分析,3-5K,经验不限，大专,济南,法定节假日三薪，员工旅游，工龄奖，全勤奖，五险一金，加班补助，底薪加提成,山东芈品经贸有限公司,数据分析，商业分析,12,4.0,大专,经验不限,7,2,批发/零售,不需要融资,100-499人,0.2623328042548666
1277,数据员,3-5K,经验不限，大专,重庆,定期体检，员工旅游，股票期权，五险一金,严实集团,结算，付款，报销，制表,12,4.0,大专,经验不限,4,4,工程施工,未融资,20-99人,0.23842037385524992
1278,数据分析,4-5K,经验不限，硕士,上海,五险一金，补充医疗保险，年终奖，加班补助，定期体检，通讯补贴，带薪年假，股票期权,NIO蔚来,Power BI，数据分析/挖掘经验，计算机相关专业，SQL,12,4.5,硕士,经验不限,8,4,汽车生产,已上市,10000人以上,0.7314409546210557
1279,数据专员,3-4K,经验不限，大专,邢台,五险，包吃，节日福利，年终奖，团建聚餐，全勤奖,河北宽衍智能装备,全职工作,12,3.5,大专,经验不限,6,1,仪器仪表/工业自动化,未融资,20-99人,0.17729555122566001
1280,数据标注,3-6K,经验不限，学历不限,安阳,团建聚餐，全勤奖，底薪加提成，保底工资，绩效奖金，五险一金,河南诚凡智能科技,全职工作，兼职工作，数据标注，图片标注，文本标注,12,4.5,学历不限,经验不限,6,5,数据服务,不需要融资,20-99人,0.35860382500785226
1281,数据标注,3-6K,经验不限，大专,新余,节日福利，包住，宿舍有空调，住房补贴，五险一金，底薪加提成，保底工资，绩效奖金，意外险，加班补助,江西云百讯,全职工作，标注结果抽查，标注结果整理，数据标注,12,4.5,大专,经验不限,10,4,计算机服务,未融资,500-999人,0.38908994638238376
1282,数据产品,20-40K·16薪,3-5年，本科,上海,节日福利，交通补助，五险一金，零食下午茶，餐补，带薪年假,永辉云创,大数据产品，产品设计，需求分析，用户研究，数据分析,16,30.0,本科,3-5年,6,5,移动互联网,已上市,1000-9999人,0.7876671834084676
1283,数据,3-5K,经验不限，学历不限,聊城,,灵鸽信息科技,音频，文字，不涉黄涉暴，图片，视频，地图,12,4.0,学历不限,经验不限,0,6,互联网,未知,0-20人,0.27037075874688093
1284,美团平台-数据仓库工程师,30-50K·15薪,1-3年，本科,北京,意外险，底薪加提成，股票期权，五险一金，节日福利，年终奖，团建聚餐，补充医疗保险，高温补贴，保底工资，商业险，带薪年假，法定节假日三薪，加班补助，夜班补助，定期体检，生日福利，工龄奖，节假日加班费，交通补助,美团,Hive，Spark，数仓设计/开发经验,15,40.0,本科,1-3年,20,3,互联网,已上市,10000人以上,1.0
1285,数据文员,3-4K,1-3年，高中,潮州,,恒然卫浴,文员，办公,12,3.5,高中,1-3年,0,2,批发/零售,未知,100-499人,0.13734982268510487
1286,数据标注,2-3K,经验不限，学历不限,保定,法定节假日三薪，保底工资，节日福利，节假日加班费，全勤奖,喜年科技,数据标注，文本标注，全职工作，语音标注，标注结果整理,12,2.5,学历不限,经验不限,5,5,电子商务,不需要融资,20-99人,0.338729530695968
1287,数据统计,2-3K,1年以内，大专,济宁,,圣德食材,业务分析，数据提取，数据分析,12,2.5,大专,1年以内,0,3,电子商务,未融资,20-99人,0.11200498203904849
1288,数据专员,3-5K,经验不限，大专,保定,,河北贝特,"数据标注,图片标注",12,4.0,大专,经验不限,0,1,移动互联网,未知,0-20人,0.07546101502630545
