,岗位名称,薪资待遇,岗位详情,岗位地区,公司福利,公司名称,岗位需要技能,salary1,salary2,学历要求,工作经验要求,福利数量,需求技能数量,公司类型,融资情况,公司人数,score
404,装备测试工程师,6-10K,3-5年，大专,南阳,员工旅游，底薪加提成，有无线网，年终奖，法定节假日三薪，补充医疗保险，股票期权，高温补贴，团建聚餐，节日福利，包住，带薪年假，宿舍有空调，餐补，保底工资，绩效奖金，节假日加班费，加班补助，定期体检，五险一金,牧原智能科技,功能测试，自动化测试，渗透测试，测试工作经验,12,8.0,大专,3-5年,20,4,智能硬件,未融资,1000-9999人,0.45393481651307105
405,雷达测试工程师,10-15K,1年以内，本科,北京,餐补，零食下午茶，定期体检，股票期权，带薪年假，年终奖，交通补助，补充医疗保险，节日福利，住房补贴，五险一金,微度芯创,Vision,12,12.5,本科,1年以内,11,1,电子/半导体/集成电路,A轮,100-499人,0.42918758862352174
406,测试工程师（c++）-汽车,15-30K·13薪,3-5年，本科,苏州,五险一金，节日福利，年终奖，股票期权，带薪年假，员工旅游，定期体检，调薪制度，通讯补贴,瀚川智能科技,MySQL,13,22.5,本科,3-5年,9,1,智能硬件,已上市,1000-9999人,0.5760933925065611
407,测试工程师（性能测试）,8-13K,1-3年，本科,成都,团建聚餐，交通补助，定期体检，工龄奖，带薪年假，年终奖，生日福利，零食下午茶，五险一金，节日福利，补充医疗保险,天府市民云,功能测试，性能测试，压力测试，JMeter，MySQL,12,10.5,本科,1-3年,11,5,数据服务,不需要融资,20-99人,0.28456036688256653
408,数据库一体机测试工程师,10-15K,3-5年，本科,武汉,五险一金，零食下午茶，带薪年假，餐补，补充医疗保险，交通补助，节日福利，通讯补贴,达梦数据库,自动化测试，计算机相关专业，测试工作经验，自动化测试经验,12,12.5,本科,3-5年,8,4,计算机软件,D轮及以上,1000-9999人,0.5456972547711437
409,诊断测试工程师,12-17K,3-5年，本科,北京,带薪年假，免费班车，五险一金，年终奖，定期体检，员工旅游,凌咚北京,测试工作经验，英语口语交流，以太网测试，车载诊断测试,12,14.5,本科,3-5年,6,4,互联网,未融资,20-99人,0.2919983153049414
410,fpga测试工程师,10-15K,经验不限，本科,北京,,国家空间科学中心,功能测试，性能测试，嵌入式测试，测试工作经验,12,12.5,本科,经验不限,0,4,学术/科研,未知,1000-9999人,0.46152921852898077
411,ssd测试工程师,15-30K·15薪,3-5年，本科,成都,生日福利，五险一金，住房补贴，零食下午茶，股票期权，带薪年假，补充医疗保险，员工旅游，定期体检，夜班补助，节日福利，团建聚餐，年终奖,德明利,自动化测试，Python，Shell,15,22.5,本科,3-5年,13,3,电子/半导体/集成电路,已上市,100-499人,0.592827832701984
412,连接器测试工程师,8-12K·13薪,3-5年，大专,厦门,加班补助，五险一金，带薪年假，全勤奖，包吃，法定节假日三薪，夜班补助，节假日加班费，节日福利，团建聚餐，员工旅游，工龄奖，高温补贴，绩效奖金，年终奖,广泓,功能测试，性能测试，连接器测试，实验室测试,13,10.0,大专,3-5年,15,4,原材料及加工/模具,未融资,100-499人,0.344899689338086
413,系统集成测试工程师,8-13K·13薪,5-10年，本科,沈阳,通讯补贴，餐补，节日福利，年终奖，零食下午茶，带薪年假，五险一金,佰为深,功能测试，嵌入式测试，自动化测试,13,10.5,本科,5-10年,7,3,医疗设备/器械,A轮,20-99人,0.21592591980328446
414,FA测试工程师,11-13K·13薪,3-5年，本科,南京,五险一金，免费班车，住房补贴，餐补，加班补助,南京欣旺达,FA失效分析,13,12.0,本科,3-5年,5,1,新能源,已上市,1000-9999人,0.4918666337359938
415,测试工程师（天津）,9-14K,经验不限，本科,天津,五险一金，补充医疗保险，定期体检，节日福利,中电金信,功能测试，性能测试，自动化测试，Python，Postman,12,11.5,本科,经验不限,4,5,计算机软件,B轮,10000人以上,0.571989008524389
416,水平衡测试工程师,10-11K,3-5年，学历不限,保定,,秦皇岛禹都水利工...,自动化测试，压力测试，计算机相关专业，测试工作经验,12,10.5,学历不限,3-5年,0,4,电力/热力/燃气/水利,未知,0-20人,0.16345647710721967
417,轮胎测试工程师（室内测试，NVH测试）,6-9K·13薪,1年以内，硕士,济宁,年终奖，节日福利，年终奖，餐补，定期体检，包住，工龄奖，五险一金,倍耐力轮胎有限公司,性能测试，功能测试,13,7.5,硕士,1年以内,8,2,汽车生产,不需要融资,1000-9999人,0.3070149981778745
418,电脑硬件测试工程师,6-11K,1-3年，大专,深圳,加班补助，定期体检，年终奖，全勤奖，五险一金，带薪年假，节日福利，员工旅游，通讯补贴,OBOO鸥柏,功能测试，性能测试，硬件测试,12,8.5,大专,1-3年,9,3,计算机硬件,不需要融资,20-99人,0.283942299934443
419,AI算法测试工程师,20-30K·13薪,5-10年，本科,上海,零食下午茶，五险一金，节日福利，年终奖，定期体检，补充医疗保险，员工旅游，包吃，带薪年假，股票期权,闪马智能,计算机相关专业，测试工作经验，算法测试，算法模型，交通,13,25.0,本科,5-10年,10,5,计算机软件,C轮,100-499人,0.5752719432888416
420,测试工程师（中高级）,10-15K,3-5年，大专,上海,五险一金，全勤奖，年终奖，带薪年假，餐补，节日福利，住房补贴，交通补助,恒创软件,自动化测试，Python，测试工作经验，自动化测试经验,12,12.5,大专,3-5年,8,4,计算机软件,未知,20-99人,0.3113686074791282
421,测试工程师-安卓/iOS,5-10K·13薪,1-3年，本科,成都,节日福利，五险一金，股票期权，零食下午茶，年终奖,火荼科技,功能测试，性能测试，自动化测试，Java，Python，MySQL,13,7.5,本科,1-3年,5,6,移动互联网,不需要融资,20-99人,0.24539584535644204
422,高级分布式存储测试工程师,12-20K·14薪,3-5年，本科,长沙,生日福利，定期体检，五险一金，带薪年假，团建聚餐，餐补，节日福利，股票期权，免费班车，通讯补贴，补充医疗保险，员工旅游,同有科技,功能测试，性能测试，Python，Shell,14,16.0,本科,3-5年,12,4,数据服务,已上市,100-499人,0.5565813026976094
423,资深测试工程师/经理,25-35K·14薪,5-10年，本科,上海,定期体检，带薪年假，员工旅游，五险一金，零食下午茶，节日福利，年终奖，餐补,艾科诺,功能测试，性能测试，自动化测试，pcr，医疗器械,14,30.0,本科,5-10年,8,5,医疗设备/器械,A轮,20-99人,0.47328438308899734
424,CP/FT测试工程师,18-35K·15薪,5-10年，本科,合肥,五险一金，补充医疗保险，定期体检，交通补助，带薪年假，年终奖，餐补，节日福利,大唐存储,自动化测试，硬件测试，Shell,15,26.5,本科,5-10年,8,3,电子/半导体/集成电路,未融资,100-499人,0.3152922099631405
425,智能驾驶测试工程师,7-9K·13薪,1-3年，本科,重庆,五险一金，意外险，工龄奖，带薪年假，员工旅游，零食下午茶，通讯补贴，团建聚餐，年终奖，定期体检,泽尔测试,自动化测试经验，计算机相关专业，通信相关专业，智能驾驶,13,8.0,本科,1-3年,10,4,汽车零部件,未融资,100-499人,0.2851571407458106
426,集成电路测试工程师,8-13K,1-3年，本科,南京,,艾创微,集成电路测试，测试工程师，集成电路芯片测试,12,10.5,本科,1-3年,0,3,互联网,A轮,20-99人,0.20673359883482656
427,自动驾驶测试工程师,15-20K,3-5年，硕士,上海,,坤浪科技,自动化测试，Python，C++，测试工作经验，计算机相关专业,12,17.5,硕士,3-5年,0,5,汽车生产,未知,20-99人,0.23980518924568442
428,测试工程师（银行项目）,9-13K,3-5年，大专,成都,补充医疗保险，节日福利，零食下午茶，员工旅游，股票期权，出差，定期体检，住房补贴，带薪年假，年终奖，五险一金，加班补助,捷科智诚,对公信贷，国结，银行测试,12,11.0,大专,3-5年,12,3,计算机软件,已上市,10000人以上,0.6531379172599574
429,电器测试工程师（主管）,6-10K,1-3年，大专,金华,加班补助，餐补，全勤奖，五险一金，节日福利,浙江航佳工贸有限公司,功能测试，性能测试，自动化测试，测试工作经验,12,8.0,大专,1-3年,5,4,家具/家电/家居,未融资,100-499人,0.23616629233110914
430,测试工程师+福利待遇好,4-8K,1-3年，大专,咸宁,,香城到家,移动端测试，PC测试,12,6.0,大专,1-3年,0,2,互联网,未知,100-499人,0.12894751711033836
431,首件测试工程师,10-15K·15薪,1-3年，大专,长沙,带薪年假，五险一金，股票期权，节日福利，定期体检，员工旅游，年终奖,进芯电子,性能测试，功能测试，Pcb，MCU，Arm,15,12.5,大专,1-3年,7,5,电子/半导体/集成电路,C轮,100-499人,0.4974811489580822
432,轻工玩具物理测试工程师,5-8K,1年以内，大专,宁波,加班补助，五险一金，带薪年假，年终奖,宁波恒实质量检测...,功能测试,12,6.5,大专,1年以内,4,1,检测/认证,未融资,500-999人,0.22965393925771266
433,5G通信测试工程师,12-24K·13薪,3-5年，本科,广州,定期体检，五险一金，年终奖，加班补助，零食下午茶，年底双薪，节日福利，带薪年假，员工旅游,世炬网络,功能测试，性能测试，自动化测试,13,18.0,本科,3-5年,9,3,通信/网络设备,C轮,100-499人,0.4520319351861196
434,系统集成测试工程师,11-20K,1-3年，硕士,武汉,免费班车，住房补贴，定期体检，节日福利，员工旅游，带薪年假，股票期权，五险一金，补充医疗保险，餐补，年终奖,武汉联影,硬件测试，性能测试，系统测试，Android，iOS，功能测试,12,15.5,硕士,1-3年,11,6,医疗设备/器械,不需要融资,1000-9999人,0.46073639037552555
435,自动驾驶仿真资深测试工程师,15-20K·14薪,1-3年，本科,苏州,免费停车，定期体检，健身房，交通补助，年终奖，意外险，补充医疗保险，通讯补贴，带薪年假，生日福利，有无线网，绩效奖金，餐补，工龄奖，五险一金，高温补贴，篮球场，篮球场,清华汽研院,LabView，prescan，carsim，simulink,14,17.5,本科,1-3年,18,4,汽车零部件,不需要融资,100-499人,0.43421909770121037
436,车载以太网测试工程师,7-10K,1-3年，本科,沈阳,零食下午茶，通讯补贴，餐补，节日福利，五险一金，带薪年假，年终奖，股票期权,东信创智,功能测试，性能测试，自动化测试，Python，C++,12,8.5,本科,1-3年,8,5,汽车零部件,未融资,100-499人,0.2736885816017384
437,嵌入式软件测试工程师,8-12K·13薪,1-3年，本科,北京,五险一金，带薪年假，员工旅游，年终奖,云海商通,嵌入式测试，Java，C++，计算机相关专业，通信相关专业,13,10.0,本科,1-3年,4,5,计算机软件,未融资,20-99人,0.308544892756132
438,分析仪器测试工程师,4-6K,1-3年，大专,石家庄,,优谱通用,功能测试，性能测试，系统测试,12,5.0,大专,1-3年,0,3,仪器仪表/工业自动化,未知,20-99人,0.10458659956836475
439,测试工程师/售后技术支持工程师,4-8K,1-3年，中专/中技,嘉兴,全勤奖，年终奖，节日福利,费莱,性能测试,12,6.0,中专/中技,1-3年,3,1,机械设备/机电/重工,未知,100-499人,0.18174235169909198
440,嵌入式软件测试工程师,10-15K·15薪,3-5年，本科,合肥,绩效奖金，节日福利，员工旅游，交通补助，员工宿舍，包住，免费班车，节假日加班费，定期体检，加班补助，年终奖，通讯补贴，团建聚餐，五险一金，补充医疗保险，工龄奖，餐补，包吃，宿舍有空调，带薪年假,阳光电源股份有限公司,通信相关专业，测试工作经验，嵌入式测试,15,12.5,本科,3-5年,20,3,新能源,已上市,1000-9999人,0.6972601499299645
441,无人驾驶测试工程师,6-9K,经验不限，本科,乌兰察布,意外险，法定节假日三薪，工龄奖，年终奖，全勤奖，定期体检，补充医疗保险，包住,鸿安达,计算机相关专业，通信相关专业，无人驾驶，Linux，矿卡,12,7.5,本科,经验不限,8,5,计算机软件,未融资,20-99人,0.28814226840192564
442,测试工程师-营销系统-P6516R,15-20K·15薪,3-5年，本科,武汉,节日福利，住房补贴，入职补贴2k，免费班车，年终奖，五险一金，加班补助，包吃，零食下午茶，员工旅游，重大消息，带薪年假，股票期权，全勤奖，游泳池，交通补助，补充医疗保险，餐补，定期体检，通讯补贴,美的,五险一金，管理规范，餐费贴补，岗位晋升,15,17.5,本科,3-5年,20,4,其他行业,已上市,10000人以上,0.8082028463648412
443,总部-测试工程师（电气专业应届生）,7-10K·14薪,经验不限，本科,厦门,年终奖，员工旅游，免费班车，带薪年假，补充医疗保险，定期体检，五险一金，加班补助，包吃,宏发股份,功能测试，性能测试,14,8.5,本科,经验不限,9,2,仪器仪表/工业自动化,未融资,未知,0.17605164523006517
444,调试工程师,5-10K,经验不限，大专,银川,包吃，节日福利，年终奖，加班补助，五险一金，餐补，定期体检,小牛自动化,自动化测试，性能测试,12,7.5,大专,经验不限,7,2,新能源,未知,1000-9999人,0.3733833231473598
445,软件测试工程师,7-12K,1-3年，大专,宿迁,绩效奖金，生日福利，节日福利，工龄奖，年终奖，定期体检，零食下午茶，五险一金，股票期权，带薪年假，员工旅游,江苏联康信息股份...,C++,12,9.5,大专,1-3年,11,1,电子/半导体/集成电路,A轮,100-499人,0.3043287879300038
446,软件测试工程师,15-25K·15薪,5-10年，本科,宁波,五险一金，定期体检，交通补助，年终奖，住房补贴，带薪年假，团建聚餐，意外险，员工旅游，节日福利，餐补，通讯补贴，生日福利，免费工装,均胜新能源研究院,掌握软件测试理论和流程，测试工作经验,15,20.0,本科,5-10年,14,2,汽车零部件,未知,100-499人,0.3148349144415228
447,软件测试工程师,10-15K,3-5年，本科,北京,五险一金，定期体检，带薪年假，节日福利,正和恒基,自动化测试，性能测试，功能测试，黑盒测试,12,12.5,本科,3-5年,4,4,工程施工,未融资,500-999人,0.357729204761262
448,软件测试工程师,9-14K,1-3年，本科,北京,餐补，节日福利，补充医疗保险，生日福利，五险一金，定期体检，带薪年假，员工旅游，年终奖，意外险，零食下午茶,中科江南,自动化测试，性能测试，Oracle，功能测试，接口测试，Linux,12,11.5,本科,1-3年,11,6,计算机软件,已上市,1000-9999人,0.7539799193626187
449,软件测试工程师,11-16K·14薪,3-5年，本科,杭州,股票期权，住房补贴，节日福利，带薪年假，员工旅游，定期体检，交通补助，餐补，补充医疗保险，五险一金，年终奖，通讯补贴,浙江大华,Python，计算机相关专业，测试工作经验,14,13.5,本科,3-5年,12,3,计算机软件,已上市,1000-9999人,0.6511349855747369
450,软件测试工程师,8-12K·15薪,经验不限，本科,深圳,员工旅游，补充医疗保险，加班补助，节日福利，年终奖，五险一金，全勤奖，带薪年假,科曼医疗,功能测试，性能测试，计算机相关专业，测试工作经验,15,10.0,本科,经验不限,8,4,医疗健康,不需要融资,1000-9999人,0.5347309953049116
451,软件测试工程师,10-13K,3-5年，大专,保定,通讯补贴，定期体检，免费班车，节日福利，零食下午茶，补充医疗保险，交通补助，加班补助，带薪年假，生日福利，五险一金，团建活动,软通动力,Python，接口自动化测试，UI自动化测试，测试开发,12,11.5,大专,3-5年,12,4,计算机软件,已上市,10000人以上,0.658155880678783
452,软件测试工程师,20-30K·16薪,5-10年，本科,北京,零食下午茶，补充医疗保险，员工旅游，节日福利，年终奖，包吃，定期体检，五险一金，股票期权，免费班车，带薪年假，餐补，交通补助,京东集团,接口测试，性能测试，自动化测试，功能测试，Linux，Shell,16,25.0,本科,5-10年,13,6,电子商务,已上市,10000人以上,0.8891008026481394
453,软件测试工程师,7-10K,在校/应届，硕士,菏泽,生日福利，加班补助，免费工装，员工旅游，五险一金，交通补助，包住，团建聚餐，宿舍有空调，包吃，节假日加班费，定期体检,精进电动,C语言，Simulink，Polyspace,12,8.5,硕士,在校/应届,12,3,汽车零部件,未融资,500-999人,0.33715549552808205
454,软件测试工程师,13-17K,1-3年，本科,深圳,节日福利，零食下午茶，五险一金，带薪年假,博奥特,MySQL，JMeter，Linux，Jmeter,12,15.0,本科,1-3年,4,4,移动互联网,不需要融资,500-999人,0.36533308133637665
455,软件测试工程师,4-6K,1-3年，本科,桂林,生日福利，节日福利，有无线网，五险一金，团建聚餐，带薪年假，绩效奖金，全勤奖，零食下午茶，定期体检，股票期权，加班补助，员工旅游，年终奖,金铱星科技,性能测试，测试开发，软件测试,12,5.0,本科,1-3年,14,3,计算机软件,天使轮,0-20人,0.20610112266124578
456,软件测试工程师,4-8K,3-5年，本科,南宁,,咪付(广西),自动化测试，软件测试,12,6.0,本科,3-5年,0,2,互联网,A轮,20-99人,0.1133751908173756
457,软件测试工程师,9-14K,1-3年，大专,杭州,餐补，周末双休，带薪年假，定期体检，专属核酸检测，交通补助，领导nice，节日福利，零食下午茶，五险一金，加班补助，年终奖，员工旅游，扁平化管理，绩效奖金，偶尔加班,InShot影笑,功能测试经验，掌握软件测试理论和流程，APP测试，测试用例,12,11.5,大专,1-3年,16,4,移动互联网,不需要融资,100-499人,0.41373233728739917
458,调试工程师,6-11K·13薪,1-3年，本科,成都,交通补助，带薪年假，住房补贴，年终奖，餐补，通讯补贴，五险一金，全勤奖，节日福利，股票期权，定期体检,奇径科技,功能测试，压力测试，性能测试，测试工作经验，AC/DC,13,8.5,本科,1-3年,11,5,电子/半导体/集成电路,未融资,0-20人,0.2387360691287526
459,软件测试,10-15K·15薪,3-5年，本科,杭州,带薪年假，餐补，补充医疗保险，交通补助，节假日礼品，加班补助，通讯补贴，定期体检，节日福利，免费班车，实习生提供住，员工旅游，年终奖，五险一金,聚光科技,测试工程师，软件测试，系统测试，容器技术,15,12.5,本科,3-5年,14,4,仪器仪表/工业自动化,已上市,未知,0.46212577033224367
460,软件测试,6-11K,经验不限，本科,南京,,租房配,Java，MySQL，REST Assured，计算机相关专业,12,8.5,本科,经验不限,0,4,计算机服务,未知,0-20人,0.17198812028446375
461,软件测试,4-6K,经验不限，大专,大连,,仁源计算机,功能测试，性能测试，自动化测试,12,5.0,大专,经验不限,0,3,计算机软件,未知,20-99人,0.17714899163796133
462,软件测试,5-6K,1-3年，大专,武汉,,湖北一颗麦穗信息技术,软件测试，接口测试,12,5.5,大专,1-3年,0,2,移动互联网,未融资,20-99人,0.10800084580179566
463,软件测试,8-12K,3-5年，大专,杭州,五险一金，节日福利，定期体检，补充医疗保险，带薪年假,武汉佰钧成技术,功能测试，性能测试，自动化测试，Python，Java，Shell,12,10.0,大专,3-5年,5,6,计算机软件,不需要融资,1000-9999人,0.4155407197556156
464,软件测试,6-10K,1-3年，本科,苏州,,量子方舟,软件测试,12,8.0,本科,1-3年,0,1,计算机软件,未融资,20-99人,0.06877927953379243
465,软件测试,15-25K,3-5年，本科,长沙,年终奖，员工旅游，股票期权，餐补，定期体检，零食下午茶，补充医疗保险，加班补助，节日福利，五险一金,华为,功能测试，自动化测试,12,20.0,本科,3-5年,10,2,计算机软件,不需要融资,10000人以上,0.41548947324658353
466,软件测试,10-15K·13薪,3-5年，本科,深圳,加班补助，五险一金，带薪年假，补充医疗保险，节日福利，定期体检,亿达信息,自动化测试，Selenium，JMeter，Postman,13,12.5,本科,3-5年,6,4,计算机软件,不需要融资,1000-9999人,0.40827341209225154
467,软件测试,10-14K,3-5年，本科,南京,五险一金，加班补助，年终奖，带薪年假，餐补，节日福利，通讯补贴，交通补助,苏宁易购,接口测试，功能测试，系统测试，接口自动化测试，软件测试,12,12.0,本科,3-5年,8,5,电子商务,已上市,10000人以上,0.6492284772680899
468,软件测试,12-18K·13薪,3-5年，本科,上海,零食下午茶，员工旅游，五险一金，加班补助，带薪年假，年终奖,驿氪EZR,自动化测试，功能测试，性能测试，Python，Postman,13,15.0,本科,3-5年,6,5,移动互联网,B轮,100-499人,0.4738125404180007
469,软件测试,5-8K,3-5年，大专,济宁,五险一金，带薪年假,数聚医疗,功能测试，性能测试，压力测试，计算机相关专业,12,6.5,大专,3-5年,2,4,医疗设备/器械,未知,0-20人,0.0793151374094828
470,软件测试,4-5K,经验不限，大专,上海,通讯补贴，五险一金，住房补贴，带薪年假，定期体检，年终奖，免费班车，餐补，零食下午茶，补充医疗保险，节日福利，员工旅游，交通补助,传音控股,功能测试，性能测试，自动化测试，JMeter，LoadRunner,12,4.5,大专,经验不限,13,5,通信/网络设备,已上市,10000人以上,0.8445727430255278
471,软件测试,7-10K·13薪,1-3年，本科,福州,,鑫晟隆,功能测试,13,8.5,本科,1-3年,0,1,计算机硬件,未知,100-499人,0.1187400612737508
472,软件测试实习生,150-200元/天,4天/周，本科,上海,五险一金，定期体检，年终奖，带薪年假,上讯信息技术,MySQL，Linux，Oracle,12,5.0,本科,经验不限,4,3,计算机软件,未融资,500-999人,0.3818127447131836
473,软件测试实习生,3-5K,经验不限，大专,上海,零食下午茶，带薪年假，节日福利，交通补助，年终奖，包吃，五险一金，定期体检，免费班车，全勤奖，住房补贴，股票期权，餐补，员工旅游，加班补助，通讯补贴,本安数字科技有限公司,软件测试,12,4.0,大专,经验不限,16,1,仪器仪表/工业自动化,未融资,100-499人,0.421623756865046
474,银行软件测试、测试开发（2024年校招）,5-6K,在校/应届，本科,济南,定期体检，加班补助，五险一金，补充医疗保险，带薪年假，节日福利,龙盈智达,功能测试，自动化测试,12,5.5,本科,在校/应届,6,2,互联网金融,不需要融资,1000-9999人,0.31114610337780363
475,软件测试开发工程师,15-30K·14薪,1-3年，本科,深圳,离职补偿，节日福利，五险一金，补充医疗保险，通讯补贴，年终奖，全勤奖，员工旅游，定期体检，带薪年假，股票期权，零食下午茶，免费班车，加班补助，住房补贴，餐补，交通补助,华为技术有限公司,云计算,14,22.5,本科,1-3年,17,1,计算机软件,不需要融资,10000人以上,0.581191198825352
476,软件测试工程师(L5838),11-20K·14薪,3-5年，本科,杭州,股票期权，通讯补贴，年终奖，交通补助，餐补，带薪年假，员工旅游，零食下午茶，五险一金，节日福利，定期体检,一知智能,计算机相关专业，视频直播，外呼语音,14,15.5,本科,3-5年,11,3,互联网,B轮,100-499人,0.4484954572696147
477,高级软件测试工程师,20-25K·14薪,5-10年，本科,深圳,五险一金，绩效奖金，零食下午茶，股票期权，带薪年假，年终奖，定期体检，员工旅游，节日福利,昂楷科技,Shell，SQL，Linux，Oracle，游戏测试,14,22.5,本科,5-10年,9,5,信息安全,C轮,100-499人,0.5467616376084733
478,软件测试工程师（珠海）,6-11K,1-3年，大专,珠海,交通补助，餐补，年终奖，五险一金，通讯补贴，定期体检，带薪年假，节日福利,赞同科技,软件测试，自动化测试,12,8.5,大专,1-3年,8,2,计算机软件,C轮,1000-9999人,0.46422102962304806
479,（初级）软件测试自动化开发工程师,6-8K,1-3年，本科,广州,零食下午茶，定期体检，年终奖，加班补助，五险一金,云岫科技,自动化测试，测试开发，软件测试,12,7.0,本科,1-3年,5,3,互联网,未融资,20-99人,0.17852243262268377
480,软件测试工程师（上海）-W21-001(J11878),18-35K·14薪,3-5年，本科,上海,定期体检，餐补，节日福利，五险一金，公租房，年终奖，股票期权，带薪年假，员工旅游，补充医疗保险，免费班车,上海联影,自动化测试，测试开发，Python，C/C++,14,26.5,本科,3-5年,11,4,医疗设备/器械,B轮,1000-9999人,0.6650768734645478
