,岗位名称,薪资待遇,岗位详情,岗位地区,公司福利,公司名称,岗位需要技能,salary1,salary2,学历要求,工作经验要求,福利数量,需求技能数量,公司类型,融资情况,公司人数,score
0,JAVA软件开发工程师,10-15K·14薪,1-3年，本科,南京,加班补助，交通补助，五险一金，零食下午茶，节日福利，定期体检，带薪年假，年终奖,南大智能,Oracle，Linux，SQL，数据结构，Spring，后端开发,14,12.5,本科,1-3年,8,6,计算机软件,未融资,100-499人,0.3645391922296772
1,软件开发工程师,15-30K,经验不限，本科,西安,年终奖，节日福利，带薪年假，股票期权，加班补助，零食下午茶，离职补偿，免费班车，餐补，补充医疗保险，交通补助，全勤奖，五险一金，定期体检，通讯补贴，员工旅游，住房补贴,华为技术有限公司,Java，架构师，后端工程师，Python,12,22.5,本科,经验不限,17,4,计算机软件,不需要融资,10000人以上,0.6242436451984834
2,软件开发工程师,15-20K,3-5年，大专,上海,零食下午茶，五险一金，员工旅游,信友科技,CSS，Spring，MySQL，Android，Framework，SQL,12,17.5,大专,3-5年,3,6,计算机软件,未融资,0-20人,0.2855266238814653
3,软件开发工程师,15-16K,1-3年，本科,金华,五险一金，加班补助，全勤奖，年终奖,云非特,分布式技术，服务器配置，微服务架构，数据结构,12,15.5,本科,1-3年,4,4,旅游,不需要融资,100-499人,0.2434869437366625
4,互联网软件开发工程师/java程序员,9-10K·13薪,3-5年，学历不限,成都,全勤奖，带薪年假，员工旅游，年终奖，补充医疗保险，零食下午茶,驰创数码,Java，Javascript，后端开发,13,9.5,学历不限,3-5年,6,3,计算机软件,未融资,0-20人,0.2269203808871494
5,软件开发工程师,5-10K,1-3年，大专,重庆,,华俊安科技,Java，Javascript，Linux,12,7.5,大专,1-3年,0,3,计算机服务,未融资,0-20人,0.07428232064523724
6,软件开发工程师-OD,13-26K·14薪,经验不限，本科,成都,夜班补助，保底工资，年终奖，法定节假日三薪，免费班车，补充医疗保险，意外险，节假日加班费，定期体检，加班补助，五险一金，绩效奖金，带薪年假，员工旅游，团建聚餐，零食下午茶，交通补助,华为云计算,Java，C/C++，Python，计算机/软件工程相关经验,14,19.5,本科,经验不限,17,4,计算机服务,不需要融资,10000人以上,0.6520943587142134
7,高级软件开发工程师（Java）,18-25K·13薪,经验不限，本科,深圳,定期体检，带薪年假，通讯补贴，零食下午茶，五险一金，员工旅游，年终奖，节日福利，股票期权,天海宸光,分布式技术，消息队列，全栈开发，架构师，计算机软件,13,21.5,本科,经验不限,9,5,计算机软件,天使轮,20-99人,0.49402189856842876
8,软件开发工程师,5-10K,1年以内，本科,永州,,湖南壕鑫纺织有限公司,Java,12,7.5,本科,1年以内,0,1,服装/纺织/皮革,未知,500-999人,0.1645940657184047
9,软件开发工程师,15-30K·15薪,经验不限，本科,深圳,企业年金，意外险，团建聚餐，补充医疗保险，法定节假日三薪，零食下午茶，免费班车，定期体检，底薪加提成，工龄奖，员工旅游，年终奖，加班补助，五险一金，保底工资，节假日加班费，生日福利,华为云计算,Python，MySQL，C/C++,15,22.5,本科,经验不限,17,3,互联网,不需要融资,10000人以上,0.7107281618195497
10,软件开发工程师,15-30K·14薪,经验不限，本科,广州,补充医疗保险，节日福利，年终奖，五险一金，餐补，定期体检，加班补助，员工旅游，股票期权，零食下午茶,华为,Java，C/C++，Python,14,22.5,本科,经验不限,10,3,计算机软件,不需要融资,10000人以上,0.5918245410328601
11,高级软件开发工程师,8-13K,1-3年，本科,常州,包吃，节日福利，免费工装，意外险，免费停车，包住，绩效奖金，工龄津贴，带薪年假，餐补，工龄奖，五险一金,常州德龙,不限，Java，计算机/软件工程相关经验，Java开发经验,12,10.5,本科,1-3年,12,4,机械设备/机电/重工,未融资,100-499人,0.2995942470673896
12,高级软件开发工程师,8-12K·14薪,1-3年，本科,南京,定期体检，员工旅游，带薪年假，法定节假日三薪，五险一金，团建聚餐，年终奖,知某数信息科技,Java，Spring，JavaScript，Java开发经验,14,10.0,本科,1-3年,7,4,计算机软件,未知,20-99人,0.2484132457298482
13,5G核心网软件开发工程师,30-60K,经验不限，本科,北京,餐补，定期体检，节日福利，五险一金，补充医疗保险，零食下午茶，年终奖，股票期权，员工旅游，加班补助,华为,Python，架构师，PHP，后端开发，c/c++，Java，go,12,45.0,本科,经验不限,10,7,计算机软件,不需要融资,10000人以上,0.8397208064527668
14,软件开发(后端),6-11K,经验不限，大专,广州,,郑州凯普,架构师，SSM，SSH,12,8.5,大专,经验不限,0,3,医疗/护理/卫生,未知,1000-9999人,0.3720421548799285
15,软件开发-JAVA开发,9-14K·13薪,3-5年，大专,嘉兴,,山东华清,Java，JavaScript，分布式技术，微服务架构,13,11.5,大专,3-5年,0,4,计算机服务,未知,100-499人,0.19599092909649465
16,Java高级应用软件开发,15-25K,3-5年，本科,杭州,高温补贴，股票期权，定期体检，年终奖，免费班车，团建聚餐，交通补助，五险一金，餐补，补充医疗保险，免息住房借款，通讯补贴，生日福利，带薪年假,海康威视,Java，中间件，系统架构,12,20.0,本科,3-5年,14,3,计算机软件,已上市,10000人以上,0.7272846332765763
17,软件工程师,3-5K,在校/应届，大专,襄阳,带薪年假，定期体检，补充医疗保险，员工旅游，年终奖，全勤奖，节日福利,湖北玖誉,Java，.NET，移动开发,12,4.0,大专,在校/应届,7,3,地产经纪/中介,未融资,100-499人,0.2590401481978969
18,软件工程师,8-12K,1-3年，本科,昆明,五险一金，绩效奖金，带薪年假，补充医疗保险，年终奖，节日福利，包吃，定期体检,中铝智能铜创科技...,Java,12,10.0,本科,1-3年,8,1,计算机服务,未融资,20-99人,0.13998414491733074
19,软件工程师,5-8K,3-5年，本科,桂林,带薪年假，工龄奖，交通补助，通讯补贴，年终奖，定期体检，意外险，五险一金,凯歌科技,Unix，Java，全栈工程师，全栈开发，服务器配置，架构师,12,6.5,本科,3-5年,8,6,计算机软件,不需要融资,20-99人,0.21166441604763334
20,软件工程师,8-10K,1-3年，本科,长沙,,泰嘉股份,HTML，PHP，CSS，MySQL，后端开发，WEB开发,12,9.0,本科,1-3年,0,6,机械设备/机电/重工,已上市,100-499人,0.4493745927358259
21,c#软件开发工程师/.net软件工程师,11-22K,经验不限，本科,上海,五险一金，加班补助，带薪年假，节日福利，零食下午茶,华规软件软件开发,C#，ASP.NET，MySQL,12,16.5,本科,经验不限,5,3,计算机软件,不需要融资,20-99人,0.35388690090375946
22,Sr. Software Engineer Radar软件工程师,11-20K,3-5年，本科,南京,,海拉南京研发中心,C语言,12,15.5,本科,3-5年,0,1,汽车零部件,未知,500-999人,0.1857918621925363
23,软件开发工程师|程序开发|前端|架构师,10-15K,3-5年，本科,洛阳,底薪加提成，绩效奖金，年终奖，带薪年假，保底工资，团建聚餐,今捷众创,Vue,12,12.5,本科,3-5年,6,1,培训机构,未融资,20-99人,0.1060463231925119
24,广告方向 - java资深开发工程师/架构师,40-50K·15薪,5-10年，本科,上海,节日福利，定期体检，年终奖，零食下午茶，员工旅游，免费班车，带薪年假，餐补，五险一金,喜马拉雅,分布式技术，微服务架构，NoSQL，MongoDB，架构师,15,45.0,本科,5-10年,9,5,移动互联网,D轮及以上,1000-9999人,0.8208442029638098
25,软件开发工程师,15-30K,经验不限，本科,南昌,加班补助，补充医疗保险，节日福利，零食下午茶，五险一金，定期体检，股票期权，餐补，员工旅游，年终奖,华为,c，c++，软件工程师，初级软件工程师，中级软件工程师,12,22.5,本科,经验不限,10,5,计算机软件,不需要融资,10000人以上,0.5798160307074411
26,app软件开发工程师,16-18K,1-3年，大专,北京,,铭嘉科技,Android客户端产品研发，架构设计/优化，Java，Kotlin,12,17.0,大专,1-3年,0,4,其他专业服务,未知,0-20人,0.24206980628227423
27,应用软件开发工程师,5-10K,5-10年，大专,台州,,芯韵科技,后端开发，软件工程师，MFC，WPF，VC++，MySQL,12,7.5,大专,5-10年,0,6,电子/半导体/集成电路,未知,0-20人,0.08631407324870541
28,web/Java软件开发工程师,8-13K,1-3年，本科,北京,生日福利，年终奖，五险一金，员工旅游，定期体检，带薪年假，节日福利,中科信利,前端开发,12,10.5,本科,1-3年,7,1,计算机软件,不需要融资,100-499人,0.28433569152809096
29,软件开发工程师,12-19K·15薪,经验不限，本科,上海,节日福利，五险一金，员工旅游，免费班车，年终奖，定期体检，带薪年假，股票期权，餐补，补充医疗保险，公租房,上海联影,Java，JavaScript，HTML，CSS，软件工程师,15,15.5,本科,经验不限,11,5,医疗设备/器械,B轮,1000-9999人,0.7402945107512807
30,软件开发工程师,25-50K,经验不限，本科,北京,员工旅游，节日福利，五险一金，补充医疗保险，加班补助，定期体检，餐补，股票期权，零食下午茶，年终奖,华为,C，Go，C++，Linux，软件工程师，计算机软件，后端开发,12,37.5,本科,经验不限,10,7,计算机软件,不需要融资,10000人以上,0.8021038456100837
31,控制软件开发工程师,8-12K·13薪,3-5年，本科,深圳,加班补助，员工旅游，节日福利，定期体检，五险一金，年终奖，带薪年假，股票期权,富泰华工业,充电桩，KEIL，IAR,13,10.0,本科,3-5年,8,3,互联网,已上市,10000人以上,0.654893572819266
32,DSP软件开发工程师,100-150元/天,4天/周，硕士,杭州,员工旅游，餐补，带薪年假，年终奖，五险一金，通讯补贴，定期体检，加班补助，节日福利，补充医疗保险，交通补助，零食下午茶,诺基亚浙江分公司,5G，C++,12,3.5,硕士,经验不限,12,2,通信/网络设备,已上市,10000人以上,0.6768263384850425
33,软件开发工程师,18-35K·16薪,经验不限，本科,上海,定期体检，五险一金，补充医疗保险，零食下午茶，加班补助，股票期权，餐补，年终奖，节日福利，员工旅游,华为,Java，C/C++，后端开发经验,16,26.5,本科,经验不限,10,3,计算机软件,不需要融资,10000人以上,0.6918790937682813
34,软件开发工程师,5-10K,3-5年，本科,滁州,免费班车，餐补，员工旅游，五险一金，定期体检，带薪年假，节日福利，全勤奖,扬子空调,单片机开发，电路设计，ARM开发，驱动开发,12,7.5,本科,3-5年,8,4,家具/家电/家居,未融资,1000-9999人,0.31334464523327277
35,软件开发工程师,10-15K,3-5年，大专,大连,通讯补贴，带薪年假，员工旅游，股票期权，定期体检，五险一金，补充医疗保险，加班补助，餐补,恒河智谷,Python，Java，Oracle，数据结构，ThinkPHP，软件工程师,12,12.5,大专,3-5年,9,6,电力/热力/燃气/水利,未融资,20-99人,0.27693517254924116
36,软件开发工程师,10-15K,1-3年，大专,苏州,,苏州天脉,系统开发,12,12.5,大专,1-3年,0,1,仪器仪表/工业自动化,未知,1000-9999人,0.25497509350575714
37,软件开发工程师,15-30K,经验不限，本科,南京,定期体检，零食下午茶，餐补，补充医疗保险，加班补助，五险一金，股票期权，员工旅游，年终奖，节日福利,华为,数据开发，数据仓库，Java，Python,12,22.5,本科,经验不限,10,4,计算机软件,不需要融资,10000人以上,0.5792582160342603
38,软件开发工程师,12-22K·13薪,1-3年，本科,常州,五险一金，交通补助，团建聚餐，带薪年假，年终奖，餐补，通讯补贴,常州仁迈生物,C#，MySQL，C#开发经验，计算机相关专业，.NET开发经验,13,17.0,本科,1-3年,7,5,医疗设备/器械,未知,0-20人,0.222472692173792
39,软件开发工程师,13-20K·13薪,3-5年，本科,青岛,零食下午茶，带薪年假，五险一金，交通补助，餐补，节日福利，股票期权，定期体检,海信视像科技,Java，C++，Android，Framework，架构师,13,16.5,本科,3-5年,8,5,电子/半导体/集成电路,已上市,未知,0.3734685201602088
40,高级软件开发测试工程师,16-22K·13薪,5-10年，本科,深圳,团建聚餐，定期体检，节日福利，意外险，免费班车，五险一金，年终奖，员工旅游，带薪年假，补充医疗保险，法定节假日三薪,奥兰若科技,C#，上位机，开发，测试，自动化,13,19.0,本科,5-10年,11,5,电子/半导体/集成电路,已上市,未知,0.46537601293277325
41,C#软件开发工程师,7-10K·13薪,1-3年，本科,成都,年终奖，五险一金，有无线网,北京华亿,C#，C#开发经验，.NET，Winform，Windows，WPF,13,8.5,本科,1-3年,3,6,计算机服务,不需要融资,20-99人,0.23072523062779565
42,高级软件开发工程师,15-30K,1-3年，本科,上海,定期体检，五险一金,上海可耐德智能科技,C++，计算机相关专业，Linux开发/部署经验,12,22.5,本科,1-3年,2,3,智能硬件,未知,0-20人,0.23514079466384932
43,高级软件开发工程师,15-18K·15薪,1-3年，本科,杭州,交通补助，节日福利，零食下午茶，定期体检，年终奖，股票期权，五险一金，带薪年假，补充医疗保险，通讯补贴，员工旅游，餐补,海康威视,C++，C语言，计算机相关专业，嵌入式软件,15,16.5,本科,1-3年,12,4,智能硬件,已上市,10000人以上,0.7727088776373015
44,Android软件开发工程师,6-11K,经验不限，大专,上海,年终奖，五险一金，包吃,凯士电子,Android客户端产品研发，研发流程优化，Java,12,8.5,大专,经验不限,3,3,仪器仪表/工业自动化,未融资,100-499人,0.3622532821082079
45,Linux C 软件开发工程师,15-30K,1-3年，本科,北京,生日福利，免费工装，员工旅游，团建聚餐，定期体检，五险一金，带薪年假，高温补贴，年终奖，有无线网，绩效奖金，股票期权,华来科技,Linux，ipc，系统集成技术，C语言，嵌入式软件开发,12,22.5,本科,1-3年,12,5,智能硬件,D轮及以上,100-499人,0.6647433146992112
46,ios软件开发工程师,15-22K,5-10年，本科,南京,股票期权，通讯补贴，零食下午茶，补充医疗保险，定期体检，交通补助，年终奖，节日福利，带薪年假，免费班车，五险一金，餐补,苏宁IT,IOS，移动端,12,18.5,本科,5-10年,12,2,互联网,已上市,10000人以上,0.6283106244104616
47,高级软件开发工程师（后端）,20-21K,10年以上，学历不限,昆明,五险一金,空间云,Python，SQL，微服务架构，网络编程，数据结构，NoSQL,12,20.5,学历不限,10年以上,1,6,计算机软件,不需要融资,20-99人,0.2694752401887115
48,C#软件开发工程师,8-13K,1-3年，大专,深圳,全勤奖，员工旅游，节日福利，五险一金，加班补助,SFM,JavaScript，.NET，多线程，MVC开发，网络编程，Winform,12,10.5,大专,1-3年,5,6,电子/半导体/集成电路,未融资,100-499人,0.3713547805442887
49,软件开发工程师,15-20K,1-3年，大专,深圳,年终奖，住房补贴，包吃，带薪年假，五险一金，交通补助,深圳精纬视,WPF，opencvshar，prism,12,17.5,大专,1-3年,6,3,仪器仪表/工业自动化,未融资,20-99人,0.29955333868415646
50,软件开发工程师,20-30K·13薪,5-10年，本科,深圳,股票期权，零食下午茶，五险一金，年终奖,深圳纳百信息技术,Linux，windows，GitHub开源项目，机器人联合控制,13,25.0,本科,5-10年,4,4,智能硬件,A轮,20-99人,0.3558338488003456
51,QT高级软件开发工程师,25-40K·13薪,3-5年，本科,无锡,节日福利，全勤奖，通讯补贴，员工旅游，补充医疗保险，带薪年假，加班补助，包吃，五险一金，年终奖,恩梯科技,QT,13,32.5,本科,3-5年,10,1,仪器仪表/工业自动化,未融资,100-499人,0.3127071357001144
52,软件开发工程师,10-15K,3-5年，本科,青岛,五险一金，补充医疗保险，交通补助，带薪年假，年终奖，加班补助，餐补，免费班车，定期体检，住房补贴，节日福利,海信网络科技,Web前端，.NET，C#,12,12.5,本科,3-5年,11,3,计算机软件,不需要融资,1000-9999人,0.34884678083346027
53,软件开发工程师,20-30K,5-10年，本科,上海,,visteon,BSP开发，Android，C++，嵌入式技术，计算机软件，汽车,12,25.0,本科,5-10年,0,6,汽车零部件,未知,100-499人,0.3447472821708781
54,C++软件开发工程师（QT）,20-40K,5-10年，本科,苏州,加班补助，补充医疗保险，带薪年假，年终奖，员工旅游，节日福利，零食下午茶，五险一金，餐补，定期体检,珂晶达,C++，QT,12,30.0,本科,5-10年,10,2,电子/半导体/集成电路,A轮,100-499人,0.37214948387091995
55,软件开发工程师,11-20K·16薪,3-5年，本科,长沙,年终奖，包吃，免费班车，股票期权，带薪年假，五险一金，定期体检，通讯补贴,中联重科,C++，C语言，计算机相关专业，C++服务端开发经验，PLC,16,15.5,本科,3-5年,8,5,机械设备/机电/重工,已上市,10000人以上,0.7047454464750321
56,软件开发工程师,15-20K,1-3年，本科,上海,股票期权，年终奖，定期体检，五险一金,春景科技,C/C++，Linux,12,17.5,本科,1-3年,4,2,计算机软件,未融资,0-20人,0.20673917500769187
57,PON 软件开发工程师,12-20K,1-3年，本科,深圳,,深圳市智路由科技,C语言，GPON，Linux开发，计算机专业,12,16.0,本科,1-3年,0,4,通信/网络设备,未知,100-499人,0.2832521128390393
58,视频应用软件开发工程师,250-330元/天,4天/周，硕士,上海,五险一金，餐补，包吃，年终奖，节日福利，股票期权，零食下午茶，补充医疗保险，带薪年假，定期体检，员工旅游,慧国(上海)软件...,.NET，多线程，Socket技术，数据结构，Winform，WPF,12,8.0,硕士,经验不限,11,6,计算机软件,已上市,1000-9999人,0.7768204168855396
59,Qt应用软件开发工程师,10-15K,1-3年，本科,广州,员工旅游，补充医疗保险，包吃，年终奖，免费班车，交通补助，通讯补贴，股票期权，餐补，五险一金，零食下午茶，定期体检，节日福利，住房补贴，带薪年假,广州视臻,C/C++，Qt,12,12.5,本科,1-3年,15,2,智能硬件,未融资,500-999人,0.37697768469900633
60,高级C++软件开发工程师,25-50K·15薪,3-5年，本科,深圳,海外工作，零食下午茶，年终奖，饭补，带薪年假，学习进修，股票期权，餐补，节日福利，健身房，定期体检，五险一金,海柔创新科技有限公司,数据结构，机器人，高级软件工程师，后端开发,15,37.5,本科,3-5年,12,4,计算机软件,D轮及以上,1000-9999人,0.7955495232002098
61,C#软件开发工程师,10-11K,3-5年，本科,泉州,五险一金，年终奖，节日福利，环境很不错,财智信息科技,.NET，C/C++，Python,12,10.5,本科,3-5年,4,3,信息安全,不需要融资,0-20人,0.07804110527641654
62,应用软件开发工程师,15-30K·15薪,5-10年，本科,广州,五险一金，带薪年假，零食下午茶，年终奖，节日福利，幸福计划，餐补，员工旅游，定期体检，加班补助,碧桂园,C++，Linux，Android，视觉图像算法,15,22.5,本科,5-10年,10,4,房地产开发,不需要融资,100-499人,0.36428263893121043
63,媒体软件开发专家/工程师,28-55K·13薪,5-10年，本科,上海,节日福利，定期体检，股票期权，零食下午茶，年终奖，带薪年假，补充医疗保险，五险一金，通讯补贴,寒武纪行歌,嵌入式技术，Linux，ARM开发，音视频编解码，流媒体技术,13,41.5,本科,5-10年,9,5,电子/半导体/集成电路,A轮,100-499人,0.5765999359973787
64,高级软件开发工程师,15-20K,1-3年，大专,东莞,带薪年假，员工旅游，股票期权，节日福利，五险一金，全勤奖，包吃，年终奖,思泉新材料,泛微OA系统开发，ERP/MES/WMS系统，金蝶云星空二次开发,12,17.5,大专,1-3年,8,3,原材料及加工/模具,未融资,100-499人,0.2937505165978734
65,电子软件开发工程师,7-12K·13薪,3-5年，本科,漳州,年终奖，五险一金，带薪年假,蒙发利,单片机开发，物联网,13,9.5,本科,3-5年,3,2,仪器仪表/工业自动化,未知,1000-9999人,0.2410478122280536
66,ARM软件开发工程师,15-30K,经验不限，本科,上海,零食下午茶，定期体检，带薪年假，五险一金，餐补，节日福利，员工旅游,柏飞电子,Linux,12,22.5,本科,经验不限,7,1,计算机软件,不需要融资,100-499人,0.4053711128091846
67,C++软件开发工程师,7-12K,1-3年，本科,武汉,,地大坤迪,C++，计算机相关专业，C++服务端开发经验，地质及相关,12,9.5,本科,1-3年,0,4,计算机软件,未知,100-499人,0.20135387503303143
68,.NET软件开发工程师,5-10K,1-3年，大专,德阳,五险一金，补充医疗保险，带薪年假，项目奖金，交通补助，通讯补贴，餐补，积分奖励，生日礼物，节日福利，零食下午茶，员工旅游,大宇信息,.NET，.NET开发经验,12,7.5,大专,1-3年,12,2,计算机软件,不需要融资,20-99人,0.20686402206387966
69,qt软件开发工程师,3-4K,经验不限，大专,深圳,绩效奖金，五险一金,千层智能,C++，Python，计算机相关专业，Qt项目开发经验,12,3.5,大专,经验不限,2,4,计算机软件,未知,0-20人,0.2368345201616893
70,电子软件开发工程师,11-20K,3-5年，大专,广州,生日福利，住房补贴，包吃，宿舍有空调，包住，节日福利，全勤奖，工龄奖，带薪年假，绩效奖金，五险一金,澳兰斯健康,电子相关专业，单片机设计经验,12,15.5,大专,3-5年,11,2,家具/家电/家居,未融资,500-999人,0.34924318257352216
71,专网通信应用软件开发工程师,10-15K,1-3年，本科,深圳,员工旅游，全勤奖，通讯补贴，五险一金，节日福利,中瑞科,数据结构，网络协议，Socket技术，Linux，STL，Windows,12,12.5,本科,1-3年,5,6,通信/网络设备,未融资,100-499人,0.3609327654190431
72,QT/C++软件开发工程师,18-20K,1-3年，大专,南京,全勤奖，节日福利，员工旅游，加班补助，年终奖,胜太电力,C++，Qt项目开发经验，QT，游戏引擎，多线程，STL，MFC,12,19.0,大专,1-3年,5,7,电力/热力/燃气/水利,未知,20-99人,0.33948808759229987
73,Android framework 软件开发工程师,15-28K·15薪,5-10年，本科,大连,绩效奖金，七险一金，补充医疗保险，年终奖，定期体检，子女福利，通讯补贴，五险一金，餐补，带薪年假，节日福利,亿咖通科技ECARX,Android开发经验，Java，C++，C，AndroidStudio,15,21.5,本科,5-10年,11,5,互联网,已上市,1000-9999人,0.6681607931390374
74,流媒体软件开发高级工程师,18-35K,3-5年，本科,上海,五险一金，年终奖，带薪年假，员工旅游,韬安,C++，音视频编解码，流媒体技术，golang，微服务架构,12,26.5,本科,3-5年,4,5,计算机软件,不需要融资,20-99人,0.34477116595554014
75,.net开发软件工程师,8-12K,3-5年，本科,上海,节日福利，年终奖，餐补，五险一金，定期体检，员工旅游，股票期权，通讯补贴，带薪年假,斐酷PHICOOL,.NET，.NET Core，C#，.NET开发经验,12,10.0,本科,3-5年,9,4,智能硬件,天使轮,20-99人,0.32401262879787335
76,电机控制器底层软件开发工程师,8-13K,1-3年，本科,北京,通讯补贴，团建聚餐，节日福利，包吃包住，包吃，五险一金，股票期权，绩效奖金，餐补，生日福利，包住，带薪年假，宿舍有空调，年终奖,宏瑞汽车,ARM开发，C语言，C++，汽车，单片机开发，底层驱动,12,10.5,本科,1-3年,14,6,汽车生产,A轮,500-999人,0.5875970618010199
77,中/高级嵌入式开发软件工程师,20-35K,3-5年，本科,北京,七险一金，补充医疗保险，零食下午茶，定期体检，加班补助，五险一金，员工旅游，带薪年假，节日福利,汉朔科技股份有限...,C语言，嵌入式技术，Linux，FreeRTOS，单片机开发,12,27.5,本科,3-5年,9,5,智能硬件,C轮,500-999人,0.6483609382675718
78,软件开发,3-5K,1-3年，大专,邢台,,叶瑞,C/C++，数据采集,12,4.0,大专,1-3年,0,2,电子商务,未知,20-99人,0.07216835896933571
79,C#软件开发,10-15K,3-5年，大专,东莞,带薪年假，包吃，零食下午茶，员工旅游，年终奖，包住，全勤奖，节日福利,尚夏网络,C#，SQL Server，C#开发经验，.NET开发经验，DEV控件,12,12.5,大专,3-5年,8,5,计算机软件,不需要融资,20-99人,0.24310603684863327
80,软件开发,5-10K,1-3年，本科,厦门,,光达信,C，STM32开发，ARM开发，通信相关专业,12,7.5,本科,1-3年,0,4,电子/半导体/集成电路,未知,0-20人,0.08074367394291429
81,软件开发程序员,3-8K,1-3年，大专,遵义,加班补助，通讯补贴，五险一金，全勤奖，员工旅游，带薪年假，节日福利,永恒光,PHP，Python，Java，计算机相关专业，PHP开发经验,12,5.5,大专,1-3年,7,5,互联网,不需要融资,20-99人,0.21664687454277237
